Dept Code,Pymt Date,Vendor Name,Vendor Number,Voucher (Batch) Number,Invoice Line Nbr,Invoice Line Amount,Invoice Number,Invoice Date,Invoice Description
1.0,2021-02-05,"HALL, PATRICK J",10530390.0,PV01210100003,1,305.7,00003-2021,2021-01-25,Travel to Springfield 1/8-1/13/2021
6.0,2021-03-29,"NOLAN, CARLETON",10551496.0,PV06190600581,1,1093.4,52585266,2019-06-11,"LODGING REIMBURSEMENT TO CIO CARLETON NOLAN/NY TRIP 6-11/6-14, 2019 CONFERENCE"
15.0,2021-01-05,"CARDONA, FELIX JR.",10560242.0,PV15201554053,1,18.0,194B0039969,2020-12-18,"Parking, gasoline, insurance and maintenance of a motor vehicle"
15.0,2021-01-05,"CARDONA, FELIX JR.",10560242.0,PV15201554068,1,55.0,029046,2020-12-18,"Postage, shipping and messenger fees"
15.0,2021-01-05,"CARDONA, FELIX JR.",10560242.0,PV15201554068,1,32.98,9569293,2020-12-21,Office supplies
15.0,2021-01-05,HUGO A. LOPEZ,57052466.0,PV15201554090,1,30.84,8009090009352506,2020-12-15,Bank fees and interest expenses
15.0,2021-01-05,"JOYCE, MAREE P",10559077.0,PV15201554096,1,194.94,127720,2020-11-19,Office supplies
15.0,2021-01-05,LISA  RYAN,54945022.0,PV15201554100,1,330.0,235,2020-12-23,"Postage, shipping and messenger fees"
15.0,2021-01-05,Paula Cline,10511789.0,PV15201554064,1,184.97,INV58679911,2020-12-21,"Telecommunications, internet and security equipment/service"
15.0,2021-01-05,Paula Cline,10511789.0,PV15201554051,1,50.0,342414,2020-12-09,Meeting costs
15.0,2021-01-05,PRENTICE  BUTLER,55035025.0,PV15201554065,1,18.0,MINT11122054663 (12/18/20),2020-12-18,"Parking, gasoline, insurance and maintenance of a motor vehicle"
15.0,2021-01-05,"RODRIGUEZ SANCHEZ, ROSSANA",10555939.0,PV15201554030,1,286.0,INV-1035436,2020-10-29,"Telecommunications, internet and security equipment/service"
15.0,2021-01-05,"RODRIGUEZ SANCHEZ, ROSSANA",10555939.0,PV15201554032,1,516.22,INV06128391,2020-11-19,"Telecommunications, internet and security equipment/service"
15.0,2021-01-05,"SADLOWSKI GARZA, SUSAN",10180140.0,PV15201553983,1,39.2,310939,2020-03-05,Transportation reimbursement
15.0,2021-01-05,"SCHRAEDER, JOYCE E",10555933.0,PV15201554087,1,334.32,323114536,2020-12-18,Office supplies
15.0,2021-01-05,"SPOSATO, NICHOLAS S",10178149.0,PV15201554129,1,500.0,INV119524,2020-12-06,Office supplies
15.0,2021-01-07,LISA  RYAN,54945022.0,PV15201554164,1,63.94,Dunkin # 308139,2020-12-12,Meeting costs
15.0,2021-01-13,"LOPEZ, RAYMOND A",10549920.0,PV15201554283,1,20.99,MC11527245,2020-12-13,"Telecommunications, internet and security equipment/service"
15.0,2021-01-13,"MCCOY, SHARRON",10187666.0,PV15201554306,1,26.0,633,2020-11-24,"Postage, shipping and messenger fees"
15.0,2021-01-13,"MCCOY, SHARRON",10187666.0,PV15201554306,1,300.0,012820,2020-12-28,Office maintenance expenses
15.0,2021-01-13,"MITCHELL, GREGORY I",10177741.0,PV15201554118,1,3748.98,92650345,2020-12-07,Other supplemental services
15.0,2021-01-13,Paula Cline,10511789.0,PV15201554209,1,417.95,2056445,2020-12-29,Office supplies
15.0,2021-01-13,"REYNOLDS, ANTONIO",10230629.0,PV15201554305,1,30.97,746306,2020-12-19,Other supplemental services
15.0,2021-01-13,"RODRIGUEZ SANCHEZ, ROSSANA",10555939.0,PV15201554031,1,308.61,295915711 (10/12/20),2020-10-12,"Telecommunications, internet and security equipment/service"
15.0,2021-01-13,"SMITH, MICHELE E",10199079.0,PV15201554063,1,1447.44,INV000768168,2020-12-15,Office equipment
15.0,2021-01-14,ALDERMAN HOWARD B BROOKINS JR,50103502.0,PV15201554163,1,400.0,Magic Performance (12/23/20),2020-12-23,Meeting costs
15.0,2021-01-20,"BARRERA, RENEE",1055919.0,PV15211550021,1,44.97,INV61227476,2021-01-04,"Telecommunications, internet and security equipment/service"
15.0,2021-01-22,ALLYSON BRISBIN,10549502.0,PV15201554146,1,140.0,INV58780012,2020-12-22,"Telecommunications, internet and security equipment/service"
15.0,2021-01-22,"BRUGH, OWEN R",10125777.0,PV15201554427,1,117.86,1410089,2020-10-01,"Telecommunications, internet and security equipment/service"
15.0,2021-01-22,"BRUGH, OWEN R",10125777.0,PV15201554428,1,39.98,1432869,2020-12-01,"Telecommunications, internet and security equipment/service"
15.0,2021-01-22,"CAPPLEMAN, JAMES J",10559110.0,PV15201554150,1,364.88,RW00324707 (12/2/20),2020-12-02,"Telecommunications, internet and security equipment/service"
15.0,2021-01-22,"HARRIS, MICHELLE A",10554588.0,PV15201554417,1,24.99,6422770,2020-12-18,"Telecommunications, internet and security equipment/service"
15.0,2021-01-22,"JOYCE, MAREE P",10559077.0,PV15201554207,1,29.0,129240,2020-12-29,Other supplemental services
15.0,2021-01-22,"NUGENT, SAMANTHA G",10545211.0,PV15201554147,1,24.0,64403,2020-11-25,Office maintenance expenses
15.0,2021-01-22,"NUGENT, SAMANTHA G",10545211.0,PV15201554147,1,342.68,INV00397321,2020-11-29,"Telecommunications, internet and security equipment/service"
15.0,2021-01-22,"NUGENT, SAMANTHA G",10545211.0,PV15201554147,1,550.0,840-5600551-4426521-1,2020-12-01,"Postage, shipping and messenger fees"
15.0,2021-01-22,"SPOSATO, NICHOLAS S",10178149.0,PV15201554229,1,1925.0,840-56000118-1-3358991-1,2020-12-28,"Postage, shipping and messenger fees"
15.0,2021-01-26,"LOPEZ, RAYMOND A",10549920.0,PV15201554072,1,525.0,112020,2020-11-20,Office maintenance expenses
15.0,2021-01-26,"LOPEZ, RAYMOND A",10549920.0,PV15201554283,1,242.29,8932151032,2020-11-19,Utility services
15.0,2021-01-26,"LOPEZ, RAYMOND A",10549920.0,PV15201554283,1,354.37,0613614742-00003 (12/8/20),2020-12-08,Utility services
15.0,2021-01-27,"LOPEZ, RAYMOND A",10549920.0,PV15201554284,1,359.96,1016250246,2020-08-17,Printers and copiers
15.0,2021-01-27,"LOPEZ, RAYMOND A",10549920.0,PV15201554284,1,27.54,5400291531,2020-10-28,Bank fees and interest expenses
15.0,2021-01-27,"LOPEZ, RAYMOND A",10549920.0,PV15201554284,1,642.95,8771 30 022 3340823 (11/20/20),2020-11-20,"Telecommunications, internet and security equipment/service"
15.0,2021-01-27,"LOPEZ, RAYMOND A",10549920.0,PV15201554284,1,404.62,287302424382,2020-12-17,"Telecommunications, internet and security equipment/service"
15.0,2021-01-28,"MITCHELL, GREGORY I",10177741.0,PV15201554475,1,9460.0,148813,2020-12-28,Office equipment
15.0,2021-01-28,"MITCHELL, GREGORY I",10177741.0,PV15201554475,1,1500.0,WT38604,2021-01-12,Office maintenance expenses
15.0,2021-01-28,"SPOSATO, NICHOLAS S",10178149.0,PV15201554230,1,2000.0,1862,2020-12-29,Other supplemental services
15.0,2021-02-02,"FADAYIRO, JOAN R",10553358.0,PV15201554158,1,167.0,24,2020-02-25,Meeting costs
15.0,2021-02-02,"FADAYIRO, JOAN R",10553358.0,PV15201554159,1,179.15,101,2020-02-04,Meeting costs
15.0,2021-02-02,Paula Cline,10511789.0,PV15211550168,1,129.38,8771 30 022 3099338 (12/27/20),2020-12-27,"Telecommunications, internet and security equipment/service"
15.0,2021-02-02,PRENTICE  BUTLER,55035025.0,PV15211550034,1,87.99,MC10645805,2021-01-13,"Telecommunications, internet and security equipment/service"
15.0,2021-02-03,Paula Cline,10511789.0,PV15211550115,1,123.38,8771 30 022 3099338 (1/27-21),2021-01-27,"Telecommunications, internet and security equipment/service"
15.0,2021-02-03,Paula Cline,10511789.0,PV15211550116,1,184.97,INV64310701,2021-01-21,"Telecommunications, internet and security equipment/service"
15.0,2021-02-04,SCOTT WAGUESPACK,50962023.0,PV15201554341,1,1210.0,840-56060057-3-4034660-1,2020-03-18,"Postage, shipping and messenger fees"
15.0,2021-02-08,"SPOSATO, NICHOLAS S",10178149.0,PV15201554228,1,732.6,114-4396692-6989014,2020-12-28,Other supplemental services
15.0,2021-02-09,"ERVIN, JASON C",10554615.0,PV15201554460,1,3016.65,9822460655,2020-09-17,"Computer equipment, software and supplies"
15.0,2021-02-09,"ERVIN, JASON C",10554615.0,PV15201554460,1,2081.81,SPI10498250,2020-12-30,Other supplemental services
15.0,2021-02-10,ALDERMAN ANTHONY BEALE,1064584.0,PV15201554300,1,1845.98,60014093282323,2020-12-31,Office equipment
15.0,2021-02-11,"BARRERA, RENEE",1055919.0,PV15211550271,1,44.97,INV66911805,2021-02-04,"Telecommunications, internet and security equipment/service"
15.0,2021-02-11,"CARDONA, FELIX JR.",10560242.0,PV15211550263,1,275.0,840-56060053-3-4740685-1,2021-01-29,"Postage, shipping and messenger fees"
15.0,2021-02-11,"ERVIN, JASON C",10554615.0,PV15201554459,1,585.28,PSI10011933A,2020-05-30,Other supplemental services
15.0,2021-02-11,"ERVIN, JASON C",10554615.0,PV15201554459,1,221.97,9822460655A,2020-09-16,Office supplies
15.0,2021-02-11,"ERVIN, JASON C",10554615.0,PV15201554459,1,618.77,12036,2020-12-10,Other supplemental services
15.0,2021-02-11,"ERVIN, JASON C",10554615.0,PV15201554459,1,399.99,21110700304622012302009,2020-12-30,Printers and copiers
15.0,2021-02-11,"ERVIN, JASON C",10554615.0,PV15201554459,1,93.48,00820011551331,2020-12-31,Other supplemental services
15.0,2021-02-11,LISA  RYAN,54945022.0,PV15201554529,1,429.93,6287924,2020-12-29,Office equipment
15.0,2021-02-11,"NUGENT, SAMANTHA G",10545211.0,PV15211550277,1,205.49,INV56704188,2020-12-10,"Telecommunications, internet and security equipment/service"
15.0,2021-02-11,"NUGENT, SAMANTHA G",10545211.0,PV15211550277,1,12.0,73553,2021-01-07,Office maintenance expenses
15.0,2021-02-12,"MARTIN, MATTHEW J",10556235.0,PV15201554542,1,349.29,7Y-vvYXviKJibr,2020-12-26,Consultants or professional services
15.0,2021-02-12,"MARTIN, MATTHEW J",10556235.0,PV15201554543,1,264.39,INV56702418,2021-02-10,"Telecommunications, internet and security equipment/service"
15.0,2021-02-12,"MARTIN, MATTHEW J",10556235.0,PV15201554544,1,1269.79,BILL-346-ot8w6p2n2n8v7jt8,2020-12-10,"Telecommunications, internet and security equipment/service"
15.0,2021-02-12,"MARTIN, MATTHEW J",10556235.0,PV15201554545,1,160.26,ivctfhuQ9tVquBVx,2020-11-12,Consultants or professional services
15.0,2021-02-12,"NUGENT, SAMANTHA G",10545211.0,PV15201554495,1,79.98,113-2160268-1599412,2020-12-14,Office equipment
15.0,2021-02-12,"NUGENT, SAMANTHA G",10545211.0,PV15201554495,1,1847.15,144654283-001,2020-12-14,Office supplies
15.0,2021-02-12,"NUGENT, SAMANTHA G",10545211.0,PV15201554495,1,137.19,MC5285248,2020-12-17,"Telecommunications, internet and security equipment/service"
15.0,2021-02-12,"NUGENT, SAMANTHA G",10545211.0,PV15201554495,36,36.0,70904,2020-12-29,Office maintenance expenses
15.0,2021-02-19,ALLYSON BRISBIN,10549502.0,PV15211550157,1,140.0,INV64426299,2021-01-21,"Telecommunications, internet and security equipment/service"
15.0,2021-02-19,DANIEL CASTANEDA 01,10561237.0,PV15201554559,1,411.95,8771 30 005 2847190 (12/4/20),2020-12-04,"Telecommunications, internet and security equipment/service"
15.0,2021-02-19,DANIEL CASTANEDA 01,10561237.0,PV15211550344,1,414.25,8771 30 005 2897190 (1/4/21),2021-01-04,"Telecommunications, internet and security equipment/service"
15.0,2021-02-22,"LOPEZ, RAYMOND A",10549920.0,PV15211550326,1,163.56,6822,2021-02-02,Office equipment
15.0,2021-02-22,"LOPEZ, RAYMOND A",10549920.0,PV15211550326,1,500.0,100,2021-02-05,Office maintenance expenses
15.0,2021-02-24,"MARTIN, MATTHEW J",10556235.0,PV15201554541,1,913.05,297579692,2020-08-24,"Telecommunications, internet and security equipment/service"
15.0,2021-03-02,"MARTIN, MATTHEW J",10556235.0,PV15211550212,1,18.87,INV56702418A,2020-12-10,"Telecommunications, internet and security equipment/service"
15.0,2021-03-02,"MARTIN, MATTHEW J",10556235.0,PV15211550212,1,46.45,7y-wYXvlkibi,2020-12-26,Consultants or professional services
15.0,2021-03-02,"MITCHELL, GREGORY I",10177741.0,PV15201554566,1,87.99,MC09549669,2020-11-06,"Telecommunications, internet and security equipment/service"
15.0,2021-03-02,"MITCHELL, GREGORY I",10177741.0,PV15201554566,1,87.99,MC09675149,2020-12-06,"Telecommunications, internet and security equipment/service"
15.0,2021-03-02,"MITCHELL, GREGORY I",10177741.0,PV15201554566,1,108.0,3030945490,2020-12-31,"Telecommunications, internet and security equipment/service"
15.0,2021-03-02,"MITCHELL, GREGORY I",10177741.0,PV15201554577,1,217.91,1537510001,2020-10-26,"Telecommunications, internet and security equipment/service"
15.0,2021-03-02,"MITCHELL, GREGORY I",10177741.0,PV15201554577,1,217.91,2298589002,2020-11-26,"Telecommunications, internet and security equipment/service"
15.0,2021-03-02,"RODRIGUEZ SANCHEZ, ROSSANA",10555939.0,PV15201554563,1,95.33,INV06236098,2020-12-19,"Telecommunications, internet and security equipment/service"
15.0,2021-03-02,"RODRIGUEZ SANCHEZ, ROSSANA",10555939.0,PV15201554564,1,143.0,INV-1040288,2020-11-29,"Telecommunications, internet and security equipment/service"
15.0,2021-03-02,"RODRIGUEZ SANCHEZ, ROSSANA",10555939.0,PV15201554564,1,13.84,INV-1044987,2020-12-29,"Telecommunications, internet and security equipment/service"
15.0,2021-03-02,SCOTT WAGUESPACK,50962023.0,PV15201554565,1,281.03,03 0612 KK6690 (06/19/20),2020-06-19,Lease or rental of a motor vehicle
15.0,2021-03-02,SCOTT WAGUESPACK,50962023.0,PV15201554565,1,281.03,03 0612 KK6690 (07/22/20),2020-07-22,Lease or rental of a motor vehicle
15.0,2021-03-02,SCOTT WAGUESPACK,50962023.0,PV15201554565,1,281.03,03 0612 KK6690 (08/20/20),2020-08-20,Lease or rental of a motor vehicle
15.0,2021-03-02,SCOTT WAGUESPACK,50962023.0,PV15201554565,1,281.03,03 0612 KK6690 (09/21/20),2020-09-21,Lease or rental of a motor vehicle
15.0,2021-03-02,SCOTT WAGUESPACK,50962023.0,PV15201554565,1,281.03,03 0612 KK6690 (10/22/20),2020-10-22,Lease or rental of a motor vehicle
15.0,2021-03-02,SCOTT WAGUESPACK,50962023.0,PV15201554565,1,281.03,03 0612 KK6690 (11/19/20),2020-11-19,Lease or rental of a motor vehicle
15.0,2021-03-03,"LOPEZ, RAYMOND A",10549920.0,PV15201554595,1,556.07,Home Depot (6/29/20 to 12/28/20),2020-12-28,Office equipment
15.0,2021-03-04,HUGO A. LOPEZ,57052466.0,PV15201554590,1,119.92,Zoom (Sep-Dec 2020),2020-09-10,"Telecommunications, internet and security equipment/service"
15.0,2021-03-04,HUGO A. LOPEZ,57052466.0,PV15201554601,1,31.68,19862143717,2020-12-23,Office equipment
15.0,2021-03-04,HUGO A. LOPEZ,57052466.0,PV15201554594,1,317.94,Adobe (July to December 2020),2020-12-19,"Computer equipment, software and supplies"
15.0,2021-03-04,HUGO A. LOPEZ,57052466.0,PV15201554592,1,121.94,Mailchimps July to December,2020-12-24,"Telecommunications, internet and security equipment/service"
15.0,2021-03-04,"LOPEZ, RAYMOND A",10549920.0,PV15201554593,1,39.99,813130460,2020-12-01,"Telecommunications, internet and security equipment/service"
15.0,2021-03-04,"LOPEZ, RAYMOND A",10549920.0,PV15201554589,1,52.23,384778,2020-11-28,"Parking, gasoline, insurance and maintenance of a motor vehicle"
15.0,2021-03-04,"LOPEZ, RAYMOND A",10549920.0,PV15201554591,1,119.98,November 2020,2020-11-01,"Telecommunications, internet and security equipment/service"
15.0,2021-03-04,"LOPEZ, RAYMOND A",10549920.0,PV15201554593,1,309.0,813250935,2020-12-01,"Telecommunications, internet and security equipment/service"
15.0,2021-03-05,"LOPEZ, RAYMOND A",10549920.0,PV15201554597,1,599.88,Jan-Dec 2020 Frontpoint,2020-12-01,"Telecommunications, internet and security equipment/service"
15.0,2021-03-05,"LOPEZ, RAYMOND A",10549920.0,PV15211550486,1,39.99,815111102,2020-12-13,"Telecommunications, internet and security equipment/service"
15.0,2021-03-05,"LOPEZ, RAYMOND A",10549920.0,PV15211550497,1,183.0,156559288 (12/28/20 - 12/28/21),2020-12-28,"Publications, subscriptions and printed materials"
15.0,2021-03-05,"LOPEZ, RAYMOND A",10549920.0,PV15201554596,1,599.88,Frontpoint (January to December 2020),2020-12-01,"Telecommunications, internet and security equipment/service"
15.0,2021-03-05,"MCCOY, SHARRON",10187666.0,PV15211550511,1,450.0,99032,2021-02-25,"Telecommunications, internet and security equipment/service"
15.0,2021-03-05,"MITCHELL, GREGORY I",10177741.0,PV15211550433,1,304.22,MC09928341,2021-02-06,"Telecommunications, internet and security equipment/service"
15.0,2021-03-05,"MITCHELL, GREGORY I",10177741.0,PV15211550434,1,438.16,2592466002,2021-01-26,"Telecommunications, internet and security equipment/service"
15.0,2021-03-05,"MITCHELL, GREGORY I",10177741.0,PV15211550434,1,430.0,5390759,2021-02-02,"Parking, gasoline, insurance and maintenance of a motor vehicle"
15.0,2021-03-05,Paula Cline,10511789.0,PV15211550520,1,184.97,INV69980588,2021-02-21,"Telecommunications, internet and security equipment/service"
15.0,2021-03-05,"RODRIGUEZ SANCHEZ, ROSSANA",10555939.0,PV15201554562,1,97.27,295915711 (11/12/20),2020-11-12,"Telecommunications, internet and security equipment/service"
15.0,2021-03-05,"RODRIGUEZ SANCHEZ, ROSSANA",10555939.0,PV15201554562,1,59.62,295915711 (12/12/20),2020-12-12,"Telecommunications, internet and security equipment/service"
15.0,2021-03-05,"RODRIGUEZ SANCHEZ, ROSSANA",10555939.0,PV15211550453,1,131.99,INV06236098 (12/19/20),2020-12-19,"Telecommunications, internet and security equipment/service"
15.0,2021-03-05,"RODRIGUEZ SANCHEZ, ROSSANA",10555939.0,PV15211550454,1,129.16,INV-1044987 (12/29/21),2020-12-29,"Telecommunications, internet and security equipment/service"
15.0,2021-03-05,"RODRIGUEZ SANCHEZ, ROSSANA",10555939.0,PV15211550508,1,37.65,295915711,2020-12-12,"Telecommunications, internet and security equipment/service"
15.0,2021-03-05,"VASQUEZ, JESSICA",10559000.0,PV15211550147,1,22.0,1064-9219-8235-2101-2103,2021-01-21,"Postage, shipping and messenger fees"
15.0,2021-03-11,"HADDEN, MARIA E",10547484.0,PV15201554603,1,7.49,SunTimes (09/29/20),2020-09-29,"Publications, subscriptions and printed materials"
15.0,2021-03-11,"HADDEN, MARIA E",10547484.0,PV15201554603,1,7.49,SunTimes (10/29/20),2020-10-29,"Publications, subscriptions and printed materials"
15.0,2021-03-11,"HADDEN, MARIA E",10547484.0,PV15201554603,1,7.49,SunTimes (11/29/20),2020-11-29,"Publications, subscriptions and printed materials"
15.0,2021-03-11,"HADDEN, MARIA E",10547484.0,PV15201554603,1,7.49,SunTimes (12/29/20),2020-12-29,"Publications, subscriptions and printed materials"
15.0,2021-03-11,"HADDEN, MARIA E",10547484.0,PV15201554604,1,79.07,3667556062 (09/24/20),2020-09-24,Utility services
15.0,2021-03-11,"HADDEN, MARIA E",10547484.0,PV15201554605,1,27.72,Tribune (10/13/20),2020-10-13,"Publications, subscriptions and printed materials"
15.0,2021-03-11,"HADDEN, MARIA E",10547484.0,PV15201554605,1,27.72,Tribune (11/10/20),2020-11-10,"Publications, subscriptions and printed materials"
15.0,2021-03-11,"HADDEN, MARIA E",10547484.0,PV15201554605,1,27.72,Tribune (12/08/20),2020-12-08,"Publications, subscriptions and printed materials"
15.0,2021-03-11,"HADDEN, MARIA E",10547484.0,PV15201554606,1,39.0,The Daily Line (10/09/20),2020-10-09,"Publications, subscriptions and printed materials"
15.0,2021-03-11,"HADDEN, MARIA E",10547484.0,PV15201554606,1,39.0,The Daily Line (11/09/20),2020-11-09,"Publications, subscriptions and printed materials"
15.0,2021-03-11,"HADDEN, MARIA E",10547484.0,PV15201554606,1,39.0,The Daily Line (12/09/20),2020-12-09,"Publications, subscriptions and printed materials"
15.0,2021-03-11,"HADDEN, MARIA E",10547484.0,PV15201554607,1,40.29,3667556062 (10/26/20),2020-10-26,Utility services
15.0,2021-03-11,"HADDEN, MARIA E",10547484.0,PV15201554607,1,45.74,3667556062 (11/24/20),2020-11-24,Utility services
15.0,2021-03-11,"HADDEN, MARIA E",10547484.0,PV15201554607,1,41.63,3667556062 (12/29/20),2020-12-29,Utility services
15.0,2021-03-11,"HADDEN, MARIA E",10547484.0,PV15201554608,1,51.44,4100981663,2020-10-02,"Telecommunications, internet and security equipment/service"
15.0,2021-03-11,"HADDEN, MARIA E",10547484.0,PV15201554608,1,51.44,4113845915,2020-11-02,"Telecommunications, internet and security equipment/service"
15.0,2021-03-11,"HADDEN, MARIA E",10547484.0,PV15201554608,1,48.12,4126718697,2020-12-02,"Telecommunications, internet and security equipment/service"
15.0,2021-03-11,"HADDEN, MARIA E",10547484.0,PV15201554609,1,62.82,294813343 (10/13/20),2020-10-13,"Telecommunications, internet and security equipment/service"
15.0,2021-03-11,"HADDEN, MARIA E",10547484.0,PV15201554609,1,62.82,294813343 (11/13/20),2020-11-13,"Telecommunications, internet and security equipment/service"
15.0,2021-03-11,"HADDEN, MARIA E",10547484.0,PV15201554609,1,36.48,294813343 (12/13/20),2020-12-13,"Telecommunications, internet and security equipment/service"
15.0,2021-03-11,"HADDEN, MARIA E",10547484.0,PV15201554623,1,62.82,287963388 (10/06/20),2020-10-06,"Telecommunications, internet and security equipment/service"
15.0,2021-03-11,"HADDEN, MARIA E",10547484.0,PV15201554623,1,62.82,287963388 (11/06/20),2020-11-06,"Telecommunications, internet and security equipment/service"
15.0,2021-03-11,"HADDEN, MARIA E",10547484.0,PV15201554623,1,50.66,287963388 (12/06/20),2020-12-06,"Telecommunications, internet and security equipment/service"
15.0,2021-03-11,"HADDEN, MARIA E",10547484.0,PV15211550626,1,3.32,4126718697 (12/2/20),2020-12-02,"Telecommunications, internet and security equipment/service"
15.0,2021-03-11,"HADDEN, MARIA E",10547484.0,PV15211550627,1,26.34,294813343 (12/13/20)B,2020-12-13,"Telecommunications, internet and security equipment/service"
15.0,2021-03-11,"HADDEN, MARIA E",10547484.0,PV15211550628,1,12.16,294813343 (12/13/20)A,2020-12-13,"Telecommunications, internet and security equipment/service"
15.0,2021-03-11,"NUGENT, SAMANTHA G",10545211.0,PV15211550506,1,299.99,79425,2021-01-29,Office maintenance expenses
15.0,2021-03-11,"NUGENT, SAMANTHA G",10545211.0,PV15211550506,1,462.52,INV00405177,2021-01-29,"Telecommunications, internet and security equipment/service"
15.0,2021-03-12,"HADDEN, MARIA E",10547484.0,PV15201554611,1,50.0,20-346,2020-11-10,Consultants or professional services
15.0,2021-03-12,"HADDEN, MARIA E",10547484.0,PV15201554611,1,100.0,20-351,2020-11-13,Consultants or professional services
15.0,2021-03-12,"HADDEN, MARIA E",10547484.0,PV15201554611,1,75.0,20-352,2020-11-14,Consultants or professional services
15.0,2021-03-12,"HADDEN, MARIA E",10547484.0,PV15201554612,1,100.0,20-394,2020-12-11,Consultants or professional services
15.0,2021-03-12,"HADDEN, MARIA E",10547484.0,PV15201554612,1,100.0,20-404,2020-12-18,Consultants or professional services
15.0,2021-03-12,"HADDEN, MARIA E",10547484.0,PV15201554612,1,50.0,20-411,2020-12-23,Consultants or professional services
15.0,2021-03-12,"HADDEN, MARIA E",10547484.0,PV15201554613,1,100.0,20-372,2020-12-04,Consultants or professional services
15.0,2021-03-12,"HADDEN, MARIA E",10547484.0,PV15201554613,1,75.0,20-393,2020-12-10,Consultants or professional services
15.0,2021-03-12,"HADDEN, MARIA E",10547484.0,PV15201554614,1,100.0,20-331,2020-10-23,Consultants or professional services
15.0,2021-03-12,"HADDEN, MARIA E",10547484.0,PV15201554614,1,100.0,20-338,2020-10-30,Consultants or professional services
15.0,2021-03-12,"HADDEN, MARIA E",10547484.0,PV15201554614,1,87.5,20-342,2020-11-05,Consultants or professional services
15.0,2021-03-12,"HADDEN, MARIA E",10547484.0,PV15201554615,1,125.0,20-320,2020-10-01,Consultants or professional services
15.0,2021-03-12,"HADDEN, MARIA E",10547484.0,PV15201554615,1,100.0,20-323,2020-10-09,Consultants or professional services
15.0,2021-03-12,"HADDEN, MARIA E",10547484.0,PV15201554615,1,150.0,20-326,2020-10-15,Consultants or professional services
15.0,2021-03-12,"HADDEN, MARIA E",10547484.0,PV15201554616,1,207.75,BILL-283-8ujabjqavf6mlqnb,2020-10-10,"Telecommunications, internet and security equipment/service"
15.0,2021-03-12,"HADDEN, MARIA E",10547484.0,PV15201554616,1,207.75,BILL-314-9ynbzn32f597ale5,2020-11-10,"Telecommunications, internet and security equipment/service"
15.0,2021-03-12,"HADDEN, MARIA E",10547484.0,PV15201554616,1,207.75,BILL-344-v67sm7jk5fyozs4a,2020-12-10,"Telecommunications, internet and security equipment/service"
15.0,2021-03-12,"HADDEN, MARIA E",10547484.0,PV15201554618,1,99.99,112-0810776-2307430,2020-12-23,Printers and copiers
15.0,2021-03-12,"HADDEN, MARIA E",10547484.0,PV15201554618,1,129.45,112-0810776-2307430A,2020-12-23,Office supplies
15.0,2021-03-12,"HADDEN, MARIA E",10547484.0,PV15201554618,1,99.99,112-5498202-0685033,2020-12-23,Printers and copiers
15.0,2021-03-12,"HADDEN, MARIA E",10547484.0,PV15201554618,1,343.96,112-5498202-0685033A,2020-12-23,Office supplies
15.0,2021-03-12,"HADDEN, MARIA E",10547484.0,PV15201554619,1,587.38,112-3054562-9536200,2020-12-23,Office supplies
15.0,2021-03-12,"HADDEN, MARIA E",10547484.0,PV15201554619,1,109.75,112-3054562-9536200A,2020-12-23,"Postage, shipping and messenger fees"
15.0,2021-03-12,"HADDEN, MARIA E",10547484.0,PV15201554619,1,416.42,112-3054562-9536200B,2020-12-23,Office equipment
15.0,2021-03-12,"HADDEN, MARIA E",10547484.0,PV15201554619,1,149.99,112-6523769-4779437,2020-12-23,Printers and copiers
15.0,2021-03-12,"HADDEN, MARIA E",10547484.0,PV15201554619,1,166.57,112-6523769-4779437A,2020-12-23,Office supplies
15.0,2021-03-12,"HADDEN, MARIA E",10547484.0,PV15201554619,1,9.24,112-9297323-0132245,2020-12-23,Office supplies
15.0,2021-03-12,"HADDEN, MARIA E",10547484.0,PV15201554620,1,9.49,112-4822137-1229027,2020-12-23,Office supplies
15.0,2021-03-12,"HADDEN, MARIA E",10547484.0,PV15201554620,1,134.37,112-7793469-0986623,2020-12-23,Office equipment
15.0,2021-03-12,"HADDEN, MARIA E",10547484.0,PV15201554622,1,1249.0,112-1433515-7799469,2020-12-23,"Computer equipment, software and supplies"
15.0,2021-03-12,"HADDEN, MARIA E",10547484.0,PV15201554622,1,1436.39,112-8586941-2845003,2020-12-23,"Computer equipment, software and supplies"
15.0,2021-03-15,"HADDEN, MARIA E",10547484.0,PV15201554610,1,100.0,20-357,2020-11-19,Consultants or professional services
15.0,2021-03-15,"HADDEN, MARIA E",10547484.0,PV15201554610,1,50.0,20-365,2020-11-25,Consultants or professional services
15.0,2021-03-15,"HADDEN, MARIA E",10547484.0,PV15201554610,1,75.0,20-368,2020-12-02,Consultants or professional services
15.0,2021-03-15,"HADDEN, MARIA E",10547484.0,PV15201554613,1,87.5,20-373,2020-12-05,Consultants or professional services
15.0,2021-03-15,"HADDEN, MARIA E",10547484.0,PV15201554618,1,149.99,112-0506642-8449016,2020-12-23,Printers and copiers
15.0,2021-03-15,"HADDEN, MARIA E",10547484.0,PV15201554620,1,1436.39,112-2236916-9799427,2020-12-23,"Computer equipment, software and supplies"
15.0,2021-03-15,"HADDEN, MARIA E",10547484.0,PV15211550664,1,207.99,112-5221699-8300236,2021-01-09,"Computer equipment, software and supplies"
15.0,2021-03-15,"LOPEZ, RAYMOND A",10549920.0,PV15211550656,1,8.46,19865220017,2021-01-30,Office equipment
15.0,2021-03-15,"LOPEZ, RAYMOND A",10549920.0,PV15211550656,1,148.37,670794,2021-03-03,"Parking, gasoline, insurance and maintenance of a motor vehicle"
15.0,2021-03-16,"HADDEN, MARIA E",10547484.0,PV15201554617,1,700.0,117-6174-751 (10/23/20),2020-10-23,"Liability, fire, casualty and theft insurance"
15.0,2021-03-16,"HADDEN, MARIA E",10547484.0,PV15201554621,1,2000.0,1351,2020-12-28,Newsletter and annual calendars
15.0,2021-03-16,"MARTIN, MATTHEW J",10556235.0,PV15211550480,1,1638.0,47th Ward (1/21 - 12/21),2021-01-01,"Telecommunications, internet and security equipment/service"
15.0,2021-03-18,"MITCHELL, GREGORY I",10177741.0,PV15201554627,1,1430.4,INV-1037998,2020-11-15,"Computer equipment, software and supplies"
15.0,2021-03-19,"LOPEZ, RAYMOND A",10549920.0,PV15211550684,1,20.99,MC1884137,2021-01-24,"Telecommunications, internet and security equipment/service"
15.0,2021-03-19,"LOPEZ, RAYMOND A",10549920.0,PV15211550685,1,39.99,819934676,2021-01-13,"Telecommunications, internet and security equipment/service"
15.0,2021-03-19,"LOPEZ, RAYMOND A",10549920.0,PV15211550686,1,99.98,15th Ward (February 2021),2021-02-01,"Telecommunications, internet and security equipment/service"
15.0,2021-03-19,"LOPEZ, RAYMOND A",10549920.0,PV15211550687,1,199.96,INV67947823,2021-02-10,"Telecommunications, internet and security equipment/service"
15.0,2021-03-19,"LOPEZ, RAYMOND A",10549920.0,PV15211550689,1,702.74,0606142296-00003 (2/23/21),2021-02-23,Utility services
15.0,2021-03-19,"LOPEZ, RAYMOND A",10549920.0,PV15211550689,1,9.95,0606142296-00003 (3/1/21),2021-03-01,Bank fees and interest expenses
15.0,2021-03-19,"LOPEZ, RAYMOND A",10549920.0,PV15211550695,1,290.46,287302423843,2021-02-07,"Telecommunications, internet and security equipment/service"
15.0,2021-03-22,PRENTICE  BUTLER,55035025.0,PV15211550655,1,216.0,Annual (3/2/21 - 3/2/22),2021-03-02,"Publications, subscriptions and printed materials"
15.0,2021-03-22,"RODRIGUEZ SANCHEZ, ROSSANA",10555939.0,PV15211550649,1,521.38,INV06452834,2021-02-19,"Telecommunications, internet and security equipment/service"
15.0,2021-03-23,"LOPEZ, RAYMOND A",10549920.0,PV15211550688,1,266.45,Comcast 8771300212689727 (12/19/20),2021-03-12,"Telecommunications, internet and security equipment/service"
15.0,2021-03-23,"LOPEZ, RAYMOND A",10549920.0,PV15211550688,1,283.0,Comcast 8771300212689727 (1/18/21),2021-03-12,"Telecommunications, internet and security equipment/service"
15.0,2021-03-23,"LOPEZ, RAYMOND A",10549920.0,PV15211550696,1,252.7,Comcast 8771300223340823 (12/16/20),2021-03-12,"Telecommunications, internet and security equipment/service"
15.0,2021-03-23,"LOPEZ, RAYMOND A",10549920.0,PV15211550696,1,234.4,Comcast 8771300223340823 (1/16/21),2021-03-12,"Telecommunications, internet and security equipment/service"
15.0,2021-03-24,MICHAEL D RODRIGUEZ,10402651.0,PV15211550748,1,24.0,338539,2021-03-10,Other supplemental services
15.0,2021-03-26,"CARDONA, FELIX JR.",10560242.0,PV15211550702,1,770.0,USPS COVID-19 Mailing (3/12/21),2021-03-12,"Postage, shipping and messenger fees"
15.0,2021-03-29,"BARRERA, RENEE",1055919.0,PV15211550716,1,44.97,INV72459671,2021-03-04,"Telecommunications, internet and security equipment/service"
15.0,2021-03-29,Paula Cline,10511789.0,PV15211550823,1,184.97,INV75638623,2021-03-21,"Telecommunications, internet and security equipment/service"
15.0,2021-03-31,BRANDON BRADFORD,10408409.0,PV15191553922,1,1896.34,416180605-001,2019-12-13,Office supplies and refreshments
25.0,2021-01-04,"GRIGSBY, SCHEAGBE MAYUMI",10552240.0,PV25202500057,1,385.0,1948082,2020-12-30,ARDC 2021- Scheagbe Grigsby
25.0,2021-01-04,"JOHNSON, JORIE R",10558080.0,PV25202500055,1,385.0,1938523,2020-12-22,ARDC DUES- JORIE JOHNSON
25.0,2021-01-04,"LEVAR, MICHELLE K",10552211.0,PV25202500056,1,385.0,1938504,2020-12-22,ARDC 2021- MICHELLE LEVAR
25.0,2021-01-08,"RIVERA, ENNEDY D",10552212.0,PV25202500059,1,385.0,1951945,2020-12-31,ARDC Registeration 2021
25.0,2021-01-08,"RIVERA, ENNEDY D",10552212.0,PV25202500060,1,100.0,4611,2020-12-31,HLAI 2021 Dues
27.0,2021-01-04,"PEKIC, CRYSTAL R",10515252.0,PV27202755006,1,14.5,55006-Nov,2020-11-20,Monthly Auditor Expense - Nov. 2020
27.0,2021-02-03,"DRAKE BUZANIS, KATINA",1053793.0,PV27202755007,1,39.09,12-21-20,2020-12-21,Central mailing envelopes
27.0,2021-02-03,"MACIAS, JESSICA",10552589.0,PV27202755009,1,85.35,12-11-20,2020-12-11,"Notice sentl by Certified ,ail"
27.0,2021-02-03,"MOSQUERA, SANDRA",10205486.0,PV27202755010,1,44.7,12-05-20,2020-12-05,Sent tax Notices
27.0,2021-03-15,"LUKATCH, NATALIA",10223741.0,PV27202755011,1,53.95,120420,2020-12-04,employee expenses
27.0,2021-03-15,"PALACIOS, SYLVIA",10559262.0,PV27202755012,1,16.8,120420,2020-12-04,travel expenses
28.0,2021-01-12,"ZUCCARO, GINA L",10559759.0,PV28202800167,1,14.0,13379,2020-11-19,Parking Meter used for event
28.0,2021-01-12,"ZUCCARO, GINA L",10559759.0,PV28202800167,1,7.0,6342,2020-11-19,Parking Meter used for event
28.0,2021-01-19,"ERVIN, MELISSA",10552704.0,PV28202800177,1,38.43,WJ25955361,2020-12-15,Supplies
28.0,2021-01-25,"ERVIN, MELISSA",10552704.0,PV28202800177,1,75.98,121620,2020-12-16,Domain for website
31.0,2021-01-12,"MURPHY, BERNARD J",10560652.0,PV31203102494,1,41.16,4620,2020-04-06,LITIGATION SUPPORT
31.0,2021-01-12,"MURPHY, BERNARD J",10560652.0,PV31203102494,1,7.75,52120,2020-05-21,LITIGATION SUPPORT
31.0,2021-01-26,"HANFORD, ELIZABETH K",10234886.0,PV31203103308,1,12.84,12112020,2020-12-14,UBER REIMBURSEMENT
31.0,2021-01-26,"HANFORD, ELIZABETH K",10234886.0,PV31203103309,1,16.46,11182020,2020-12-01,UBER
31.0,2021-01-27,"BENSON, VICTORIA R",10152301.0,PV31203103500,1,54.45,20200167,2021-01-11,A&F COURT REPORTER TRANSCRIPTS
31.0,2021-02-18,"MCGEE, MICHELE M",10529549.0,PV31203101256,1,20.0,00724,2019-12-11,PARKING
31.0,2021-02-24,"BUCKNER, PATRICIA A",10152560.0,PV31203103725,1,5.0,00096818,2020-10-28,NOTARY RENEWAL
31.0,2021-03-02,"GRIFF, JESSICA",10180663.0,PV31203103410,1,306.54,12/31/2020,2021-01-05,"TRAVEL REIMBURSEMENT FOR TRIP TO DENVER, CO ON 12/18 -19/2020 FOR DEPOSITION"
31.0,2021-03-15,"HANFORD, ELIZABETH K",10234886.0,PV31213100161,1,14.22,Receipt #1492913401414912254,2021-01-05,LYFT
31.0,2021-03-15,"HANFORD, ELIZABETH K",10234886.0,PV31213100161,1,14.71,Receipt #1493338646884516592,2021-01-07,LYFT
31.0,2021-03-15,"HILAL, SUZANNE",10544440.0,PV31213100309,1,50.0,0923,2020-09-23,REIMBURSEMENT FOR VIRTUAL COURT HEARING
31.0,2021-03-16,"HANFORD, ELIZABETH K",10234886.0,PV31213100279,1,14.32,UBER JAN2021,2021-01-20,UBER
31.0,2021-03-16,"HANFORD, ELIZABETH K",10234886.0,PV31213100279,1,12.82,RECEIPT#1495578918940775064,2021-01-13,LYFT
31.0,2021-03-16,"HANFORD, ELIZABETH K",10234886.0,PV31213100279,1,13.81,UBER FEB2021,2021-02-16,UBER
31.0,2021-03-16,"HANFORD, ELIZABETH K",10234886.0,PV31213100279,1,13.99,RECEIPT#1511475121611966792,2021-02-26,LYFT
33.0,2021-01-15,"MC CARTHY, JACQUELINE F",10223501.0,PV33203300270,1,5100.0,PV33203300270,2020-12-31,LIS 745 & 885 SUMMER 2017
33.0,2021-02-03,"GARDNER, MICHELLE N",10122552.0,PV33213300200,1,1884.0,PV33213300200,2021-02-01,SPRING 2019 NURS 5515
33.0,2021-02-12,"MEDINA, DANIEL",10153200.0,PV33213300101,1,5100.0,PV33213300101,2021-02-08,FALL 2019 TUITION LIS
33.0,2021-03-15,"ADEYEMO, LATIFA",10548801.0,PV33213300201,1,4895.34,PV33213300201,2021-03-08,SPRING 2019 TUITION   ACCT 405 & MGMT403
33.0,2021-03-24,"RUIDL, REBECCA S",10559628.0,PV33203300331,1,3360.0,PV33203300331,2020-12-09,FALL 2018 CHLD421 CHLD414
33.0,2021-03-24,"RUIDL, REBECCA S",10559628.0,PV33203300332,1,3360.0,PV33203300332,2020-12-09,SPRING 2019 CHLD410 CHLD426
33.0,2021-03-31,"DEMARSE, DANIEL J",10557369.0,PV33213300111,1,2544.0,PV33213300111,2021-03-26,SPRING 2019 IS 409 AND IS 462
33.0,2021-03-31,"LEWIS, KEVIN I",10559071.0,PV33213300110,1,1291.5,PV33213300110,2021-03-26,SPRING 2019 FINC 525
33.0,2021-03-31,"LEWIS, KEVIN I",10559071.0,PV33213300110,1,1722.0,PV33213300110A,2021-03-26,SUMMER 2019 HRMT 535
33.0,2021-03-31,"LEWIS, KEVIN I",10559071.0,PV33213300110,1,3444.0,PV33213300110B,2021-03-26,FALL 2019 HRMT 536 HRMT 537
38.0,2021-01-22,"KIRBY, KEVIN M",10237142.0,PV38203801005,1,150.0,SI239986,2020-06-03,"AMERICAN REGISTRY INTERNET NUMBERS PURCHASE, PERSONAL CREDIT CARD USAGE REIMBURSEMENT TO KEVIN KIRBY"
38.0,2021-02-01,"FRIEDLANDER, CHARLES",10154677.0,PV38203801044,1,165.0,ASE TEST 2020,2020-10-29,Reimbursement for ASE test
38.0,2021-03-12,"CUSACK, DANIEL D",10191130.0,PV38213800117,1,70.0,ECC95107-6,2021-03-04,REIMBURSEMENT YEARLY RENEWAL
41.0,2021-01-22,"SINGLER, JOHN",10544358.0,PV41204101561,1,195.0,20-01561,2020-10-22,Asbestos Building Inspector Refresher EMPLOYEE REIMBURSEMENT FOR STAFF 10-22-20
41.0,2021-02-08,"WEBB, SHARITA J",10551403.0,PV41204101375,1,126.0,20-01375,2020-10-28,EMPLOYEE REIMBURSEMENT FOR PARKING EXP. AUG TO SEP 2020
41.0,2021-02-12,BLESILDA GUILLEN,1058224.0,PV41204101966,1,6.2,20-01966,2020-12-02,PARKING EXPENSE NOV 2020 6.20
41.0,2021-02-24,BLESILDA GUILLEN,1058224.0,PV41204101960,1,5.86,20-01960,2020-12-17,PARKING EXPENSE DEC 2020 5.86
41.0,2021-02-24,"BRILL, MATTHEW ROBERT",10552289.0,PV41204101394,1,134.0,20-01394,2020-10-02,PARKING EXPENSE SEP 2020
41.0,2021-02-24,"BRILL, MATTHEW ROBERT",10552289.0,PV41204101627,1,150.0,20-01627,2020-10-30,PARKING EXPENSE OCT 2020
41.0,2021-02-24,"CHAVEZ TORRES, MARIBEL",10127544.0,PV41204101858,1,300.0,49605,2020-10-16,Reimbursment for the job posting of the Manager of Food Protection Services
41.0,2021-02-24,"COOK, BRIANA CAMILLE",10515532.0,PV41204101641,1,38.0,20-1641,2020-11-24,"Parking Expensess Oct,202"
41.0,2021-02-24,"COOK, BRIANA CAMILLE",10515532.0,PV41204101957,1,33.4,20-01957,2020-11-27,PARKING EXPENSE NOV 2020 33.40
41.0,2021-02-24,DAVID SANETRA,1044727.0,PV41204101608,1,82.0,20-0608,2020-11-10,PARKING EXPENSE OCT 2020
41.0,2021-02-24,DAVID SANETRA,1044727.0,PV41204101609,1,51.0,20-1609,2020-11-20,"November 5, 12, 19 2020 Parking Expenses"
41.0,2021-02-24,"EDWARDS, JACQUELINE D",10131431.0,PV41204101615,1,84.54,20-01615,2020-10-05,PARKING EXPENSE AUG 2020
41.0,2021-02-24,"EDWARDS, JACQUELINE D",10131431.0,PV41204101630,1,76.17,20-1630,2020-11-30,Sept-20 Parking Expenses
41.0,2021-02-24,"EDWARDS, JACQUELINE D",10131431.0,PV41204101642,1,73.6,20-01642,2020-11-09,PARKING EXPENSE OCT 2020 73.60
41.0,2021-02-24,"EDWARDS, JACQUELINE D",10131431.0,PV41204101961,1,15.24,20-1961,2020-12-01,"Parking Expenses Nov,2020"
41.0,2021-02-24,"HEINERICH, MOLLY",10143815.0,PV41204101631,1,11.83,20-01631,2020-10-29,PARKING EXPENSE SEP 2020
41.0,2021-02-24,"HENRY, MURIELLE",10548837.0,PV41204101632,1,29.2,20-01632,2020-10-15,PARKING EXPENSE SEP 2020
41.0,2021-02-24,"HENRY, MURIELLE",10548837.0,PV41204101633,1,25.53,20-1633,2020-11-13,"Parking Expenses October,2020"
41.0,2021-02-24,"HENRY, MURIELLE",10548837.0,PV41204101941,1,50.81,20-1941,2020-12-02,"Parking Expenses for Dec, 2020"
41.0,2021-02-24,"HENRY, MURIELLE",10548837.0,PV41204101943,1,17.75,201943,2020-12-03,Parking Expenses Nov-2020
41.0,2021-02-24,"KHAMPHOUNVONG, JAY V",10127656.0,PV41204101396,1,21.8,20-01396,2020-10-07,PARKING EXPENSE SEP 2020
41.0,2021-02-24,"KURCZEWSKI, MICHAEL T",10130529.0,PV41204101637,1,18.0,20-1637,2020-11-13,"Parking Expenses for Oct, 2020"
41.0,2021-02-24,"KURCZEWSKI, MICHAEL T",10130529.0,PV41204101942,1,30.96,20-01942,2020-12-23,PARKING EXPENSE DEC 2020
41.0,2021-02-24,"KURCZEWSKI, MICHAEL T",10130529.0,PV41204101944,1,29.71,20-01944,2020-12-02,PARKING EXPENSE NOV 2020 29.71
41.0,2021-02-24,"MARTINEZ-CEBALLOS, ELVIA",10127650.0,PV41204101954,1,58.42,20-01954,2020-12-17,PARKING EXPENSE SEP/ DEC 2020 58.42
41.0,2021-02-24,"MARTIN, NOLA I",10126625.0,PV41204101392,1,10.49,20-01392,2020-09-30,PARKING EXPENSE SEP 2020
41.0,2021-02-24,"MARTIN, NOLA I",10126625.0,PV41204101638,1,4.0,20-01638,2020-11-04,PARKING EXPENSE OCT 2020
41.0,2021-02-24,"MARTIN, NOLA I",10126625.0,PV41204101955,1,15.07,20-01955,2020-12-18,11/17 & 24 PARKING EXPENSE DEC 2020 15.07
41.0,2021-02-24,"MARTIN, NOLA I",10126625.0,PV41204101956,1,9.09,20-1956,2020-12-03,Nov 2020 Parking Expenses
41.0,2021-02-24,"MITCHELL, EDWINA JANE'T",10551995.0,PV41201001951,1,93.11,20-1951,2020-12-31,"Parking Expenses Dec,2020"
41.0,2021-02-24,"MITCHELL, EDWINA JANE'T",10551995.0,PV41204101634,2,149.5,20-01634,2020-10-30,PARKING EXPENSE OCT 2020
41.0,2021-02-24,"MITCHELL, EDWINA JANE'T",10551995.0,PV41204101953,1,150.64,20-1953,2020-12-04,"Parking Expenses for Nov, 2020"
41.0,2021-02-24,"RITGER, KATHLEEN A",10127658.0,PV41204101807,1,1265.0,201807,2020-12-22,"TB Patients Incentives November, 2020"
41.0,2021-02-24,"RITGER, KATHLEEN A",10127658.0,PV41204101897,1,270.0,20-1897,2020-12-31,TB Patient Incentives for December 2020
41.0,2021-02-24,"SALAZAR, JAIRO A",10126267.0,PV41204101947,1,9.03,20-1947,2020-12-04,"Parking Expenses Nov, 2020"
41.0,2021-02-24,"SU, JESUS F",10127550.0,PV41204101643,1,47.97,20-01643,2020-11-17,PARKING EXPENSE OCT 2020
41.0,2021-02-24,"SU, JESUS F",10127550.0,PV41204101964,1,39.61,20-01964,2020-12-31,PARKING EXPENSE DEC 2020 39.61
41.0,2021-02-24,"SU, JESUS F",10127550.0,PV41204101965,1,28.46,20-1965,2020-12-03,"Parking Expenses Nov,2020"
41.0,2021-02-24,"TAMIMI, MARWAN M",10132484.0,PV41204101390,1,10.5,20-01390,2020-10-01,PARKING EXPENSE SEPT 2020
41.0,2021-02-24,"TAMIMI, MARWAN M",10132484.0,PV41204101635,1,37.32,20-1635,2020-11-13,"Parking Expenses Sept 16, ,2020 and Oct 2020"
41.0,2021-02-24,"TAMIMI, MARWAN M",10132484.0,PV41204101962,1,10.8,20-01962,2021-01-08,PARKING EXPENSE DEC 2020 10.80
41.0,2021-02-24,"TAMIMI, MARWAN M",10132484.0,PV41204101963,1,23.3,20-1963,2020-12-04,"Parking Expenses Nov,2020"
41.0,2021-02-24,"TURKALY, BRIAN A",10131512.0,PV41204101636,1,21.45,20-01636,2020-11-05,PARKING EXPENSE OCT 2020
41.0,2021-02-24,"TURKALY, BRIAN A",10131512.0,PV41204101945,1,12.7,20-1945,2020-12-03,Parking Expenses Nov.2020
41.0,2021-02-24,"TURKALY, BRIAN A",10131512.0,PV41204101946,1,8.0,20-01946,2020-12-31,PARKING EXPENSE DEC 2020
41.0,2021-02-24,"WILSON, GLORIA W",10515428.0,PV41204101388,1,53.78,20-01388,2020-09-18,PARKING EXPENSE JULY 2020
41.0,2021-02-24,"WILSON, GLORIA W",10515428.0,PV41204101640,1,24.24,20-1640,2020-11-13,"Parking Expenses October,2020"
41.0,2021-03-12,"MILLER, LORETTA",10137515.0,PV41204101820,1,25.48,20-1820,2020-12-17,Water and food items to help TB patients ingest their medication
48.0,2021-02-26,"McGLEAM, CHRISTINA MULLINS",10154250.0,PV48214800005,1,8.25,021521,2021-02-15,Reimbursement for Registraion and Postage paid
48.0,2021-02-26,"McGLEAM, CHRISTINA MULLINS",10154250.0,PV48214800005,2,100.0,021521,2021-02-15,Reimbursement for Registraion and Postage paid
48.0,2021-03-15,"ARFA, RACHEL M",10561724.0,PV48214800008,1,100.0,030221,2021-03-02,Reimbursement for registration fee paid
54.0,2021-01-06,"COX, MAURICE D",10552865.0,PV54205400207,1,45.98,12042020EXP,2020-12-04,Local travel on 12/4/20 EMPLOYEE REIMBURSEMENT FOR COMMISSION MAURICE COX 12/04/2020
54.0,2021-02-17,"KLAIBER, DANIEL R",10235779.0,PV54205400253,1,246.86,JUN24-25EXP,2020-06-24,EMPLOYEE EXPENSE REIMBURSEMENT REQUEST
54.0,2021-02-17,"KLAIBER, DANIEL R",10235779.0,PV54205400253,1,246.86,DEC252020EXP,2020-12-25,EMPLOYEE EXPENSE REIMBURSEMENT REQUEST
57.0,2021-01-06,WILLIAM RIGA JR,10122861.0,PV57205795254,1,710.04,16DEC2020_710.04,2020-12-17,"HEROS TO HEROS OUTFITS - SUPERMAN, BLACK PANTHER, & SPIDERMAN"
57.0,2021-01-15,ARAMON H THOMAS,50075088.0,PV57205795263,1,20.0,ARAMANTHOMAS_28SEPT20_20,2020-09-28,IDPH FIRST RESPONDER LICENSE RENEWAL FOR WATER OPERATIONS
57.0,2021-01-15,DALE POTTER JR,54600026.0,PV57205795261,1,60.0,DPOTTER_09SEPT20_60,2020-09-30,T-MOBILE LAW ENFORCEMENT RELATIONS-09SEPT2020-19OCT2020_360
57.0,2021-01-15,DALE POTTER JR,54600026.0,PV57205795261,1,120.0,DPOTTER_15OCT2020_120,2020-10-15,T-MOBILE LAW ENFORCEMENT RELATIONS
57.0,2021-01-15,DALE POTTER JR,54600026.0,PV57205795261,1,60.0,DPOTTER_9OCT202060,2020-10-09,T-MOBILE LAW ENFORCEMENT RELATIONS
57.0,2021-01-15,"MALANIUK, MICHAEL S",10560859.0,PV57205795264,1,20.0,MMALANIUK_09DEC2020_20.00,2020-12-09,IDPH FIRST RESPONDER LICENSE RENEWAL FOR WATER OPERATIONS
57.0,2021-01-20,"CATINO, SHARON L",10125851.0,PV57205795279,1,165.38,011318019196,2020-12-14,PURCHASE OF MENORAH FOR PUBLIC SAFETY HEADQUARTERS LOBBY
57.0,2021-01-21,"ACOSTA, NATALIE",10551292.0,PV57205790817,1,3870.0,205790817,2021-01-12,CPD Tuition Reimbursement
57.0,2021-01-21,"ALICEA, JASMINE A",10551291.0,PV57205790818,1,3780.0,205790818,2021-01-12,CPD Tuition Reimbursement
57.0,2021-01-21,ALICE YAU,1041826.0,PV57205790927,1,3357.0,205790927,2021-01-12,CPD Tuition Reimbursement
57.0,2021-01-21,"BARDNEY, KAHLAN A",10551398.0,PV57205790819,1,2400.0,205790819,2021-01-12,CPD Tuition Reimbursement
57.0,2021-01-21,"BAUTISTA, JOSE",10512073.0,PV57205790820,1,3840.0,205790820,2021-01-12,CPD Tuition Reimbursement
57.0,2021-01-21,"BISHOP, MARIE A",50395022.0,PV57205790821,1,3870.0,205790821,2021-01-12,CPD Tuition Reimbursement
57.0,2021-01-21,"BLUNT, RITA M",52132026.0,PV57205790822,1,1920.0,205790822,2021-01-12,CPD Tuition Reimbursement
57.0,2021-01-21,"BRANDOLINO, BRIAN W",10512060.0,PV57205790823,1,2880.0,205790823,2021-01-12,CPD Tuition Reimbursement
57.0,2021-01-21,"BROOKS, MALCOLM D",10551392.0,PV57205790824,1,1856.0,205790824,2021-01-12,CPD Tuition Reimbursement
57.0,2021-01-21,"BROWN, ALEXUS J",10553484.0,PV57205790825,1,3870.0,205790825,2021-01-12,CPD Tuition Reimbursement
57.0,2021-01-21,"BROWNFIELD, CRAIG C",10551390.0,PV57205790826,1,666.23,205790826,2021-01-12,CPD Tuition Reimbursement
57.0,2021-01-21,"CAMARILLO JR, RODOLFO",10551454.0,PV57205790827,1,2880.0,205790827,2021-01-12,CPD Tuition Reimbursement
57.0,2021-01-21,"CAMPBELL, MICHAEL P",10551459.0,PV57205790828,1,3870.0,205790828,2021-01-12,CPD Tuition Reimbursement
57.0,2021-01-21,"CANNON, JOHN M",53549024.0,PV57205790829,1,5100.0,205790829,2021-01-12,CPD Tuition Reimbursement
57.0,2021-01-21,CARA A KUPRIANCZYK,50647027.0,PV57205790830,1,1746.9,205790830,2021-01-12,CPD Tuition Reimbursement
57.0,2021-01-21,"COTTO, JOSHUA E",10544244.0,PV57205790831,1,3840.0,205790831,2021-01-12,CPD Tuition Reimbursement
57.0,2021-01-21,"CUSIMANO, DANIELLE",10193539.0,PV57205790832,1,3667.5,205790832,2021-01-12,CPD Tuition Reimbursement
57.0,2021-01-21,"DANA, AMIR",10551448.0,PV57205790833,1,2880.0,205790833,2021-01-12,CPD Tuition Reimbursement
57.0,2021-01-21,"DIARRA, MAMADOU",10551446.0,PV57205790834,1,2880.0,205790834,2021-01-12,CPD Tuition Reimbursement
57.0,2021-01-21,"DIAZ, JUAN",10551449.0,PV57205790835,1,3870.0,205790835,2021-01-12,CPD Tuition Reimbursement
57.0,2021-01-21,"DINEEN, MICHAEL E",50105249.0,PV57205790836,1,4492.5,205790836,2021-01-12,CPD Tuition Reimbursement
57.0,2021-01-21,"DOMINGUEZ, YANEIRE",10236248.0,PV57205790837,1,2880.0,205790837,2021-01-12,CPD Tuition Reimbursement
57.0,2021-01-21,"DUDA, EWELINA M",10544246.0,PV57205790838,1,2623.34,205790838,2021-01-12,CPD Tuition Reimbursement
57.0,2021-01-21,"DUNN, DANIELLE",10544249.0,PV57205790839,1,3840.0,205790839,2021-01-12,CPD Tuition Reimbursement
57.0,2021-01-21,"ELLIOTT, WILLIAM S",10553494.0,PV57205790840,1,1224.0,205790840,2021-01-12,CPD Tuition Reimbursement
57.0,2021-01-21,"ESCALANTE, EDUARDO",10551453.0,PV57205790841,1,2880.0,205790841,2021-01-12,CPD Tuition Reimbursement
57.0,2021-01-21,"EVANS, JERMAINE",10544250.0,PV57205790842,1,3840.0,205790842,2021-01-12,CPD Tuition Reimbursement
57.0,2021-01-21,"FAGIANO, CARISSA",10551445.0,PV57205790843,1,2940.0,205790843,2021-01-12,CPD Tuition Reimbursement
57.0,2021-01-21,"FATIGATI, JAMES",10544251.0,PV57205790844,1,3840.0,205790844,2021-01-12,CPD Tuition Reimbursement
57.0,2021-01-21,"FELTERS, LONNIE",10512069.0,PV57205790845,1,1965.0,205790845,2021-01-12,CPD Tuition Reimbursement
57.0,2021-01-21,"FLETCHER, AKILAH ZALIKA",10551442.0,PV57205790846,1,2880.0,205790846,2021-01-12,CPD Tuition Reimbursement
57.0,2021-01-21,"FORD, ARTHELIA S",10175580.0,PV57205790847,1,3667.5,205790847,2021-01-12,CPD Tuition Reimbursement
57.0,2021-01-21,"FOSTER, MARK S",10512064.0,PV57205790848,1,1875.0,205790848,2021-01-12,CPD Tuition Reimbursement
57.0,2021-01-21,"GARCIA, ADOLFO",10544254.0,PV57205790849,1,3667.5,205790849,2021-01-12,CPD Tuition Reimbursement
57.0,2021-01-21,"GARCIA, FRANK",10512199.0,PV57205790850,1,2880.0,205790850,2021-01-12,CPD Tuition Reimbursement
57.0,2021-01-21,"GARCIA JR, JOSE L",10555573.0,PV57205790851,1,2880.0,205790851,2021-01-12,CPD Tuition Reimbursement
57.0,2021-01-21,"GARDNER, KEITH",10551436.0,PV57205790852,1,3870.0,205790852,2021-01-12,CPD Tuition Reimbursement
57.0,2021-01-21,"GOLEN, PAUL",10551400.0,PV57205790853,1,4050.0,205790853,2021-01-12,CPD Tuition Reimbursement
57.0,2021-01-21,"GOMEZ, JOSE",10555572.0,PV57205790854,1,2880.0,205790854,2021-01-12,CPD Tuition Reimbursement
57.0,2021-01-21,"GUTIERREZ, SYLVIA",10557533.0,PV57205790855,1,2880.0,205790855,2021-01-12,CPD Tuition Reimbursement
57.0,2021-01-21,"HANNA, MARK",10512035.0,PV57205790856,1,3840.0,205790856,2021-01-12,CPD Tuition Reimbursement
57.0,2021-01-21,"HARO, ABEL",10189216.0,PV57205790857,1,3667.5,205790857,2021-01-12,CPD Tuition Reimbursement
57.0,2021-01-21,"HERRERA, CHRISTIAN",10555571.0,PV57205790858,1,1140.0,205790858,2021-01-12,CPD Tuition Reimbursement
57.0,2021-01-21,"HOLLAND, LESLIE R",10512192.0,PV57205790859,1,3750.0,205790859,2021-01-12,CPD Tuition Reimbursement
57.0,2021-01-21,"IMBURGIA, GIUSEPPE",10551444.0,PV57205790860,1,5240.0,205790860,2021-01-12,CPD Tuition Reimbursement
57.0,2021-01-21,"INSLEY, GREGORY J",10551404.0,PV57205790861,1,3870.0,205790861,2021-01-12,CPD Tuition Reimbursement
57.0,2021-01-21,"JACKSON, LEE",10512205.0,PV57205790862,1,2880.0,205790862,2021-01-12,CPD Tuition Reimbursement
57.0,2021-01-21,"JADOU, GEORGE",10551399.0,PV57205790863,1,3870.0,205790863,2021-01-12,CPD Tuition Reimbursement
57.0,2021-01-21,"KASPRZAK, DAWID",10544277.0,PV57205790865,1,3840.0,205790865,2021-01-12,CPD Tuition Reimbursement
57.0,2021-01-21,"KORNACKI, MAGDALENA",10547339.0,PV57205790866,1,7260.0,205790866,2021-01-12,CPD Tuition Reimbursement
57.0,2021-01-21,"KUBIAK, CAROLYN S",10512191.0,PV57205790867,1,3840.0,205790867,2021-01-12,CPD Tuition Reimbursement
57.0,2021-01-21,"LASTER, ERIC",10544278.0,PV57205790868,1,2880.0,205790868,2021-01-12,CPD Tuition Reimbursement
57.0,2021-01-21,"LLOYD, KIMBERLY D",50076281.0,PV57205790869,1,3200.0,205790869,2021-01-12,CPD Tuition Reimbursement
57.0,2021-01-21,"LOMBARDI, SARAH F",10193561.0,PV57205790870,1,3840.0,205790870,2021-01-12,CPD Tuition Reimbursement
57.0,2021-01-21,"LOPEZ, FRANCISCO",10193563.0,PV57205790872,1,3667.5,205790872,2021-01-12,CPD Tuition Reimbursement
57.0,2021-01-21,"LOPEZ, TAISA J",10555567.0,PV57205790871,1,1788.0,205790871,2021-01-12,CPD Tuition Reimbursement
57.0,2021-01-21,"MACDONALD, LAURA",10512253.0,PV57205790873,1,3840.0,205790873,2021-01-12,CPD Tuition Reimbursement
57.0,2021-01-21,"MAKROPOULOS, MARINA",10512043.0,PV57205790874,1,2400.0,205790874,2021-01-12,CPD Tuition Reimbursement
57.0,2021-01-21,"MANGUERRA, GLENN L",10512046.0,PV57205790875,1,7260.0,205790875,2021-01-12,CPD Tuition Reimbursement
57.0,2021-01-21,"MARIN, JULIAN",10532460.0,PV57205790876,1,3750.0,205790876,2021-01-12,CPD Tuition Reimbursement
57.0,2021-01-21,"MARTINEZ, RODOLFO",10236688.0,PV57205790877,1,2880.0,205790877,2021-01-12,CPD Tuition Reimbursement
57.0,2021-01-21,"MARTINO, NIKOLO J",10551431.0,PV57205790878,1,3150.0,205790878,2021-01-12,CPD Tuition Reimbursement
57.0,2021-01-21,"MENDEZ, CESAR",10532461.0,PV57205790879,1,2158.0,205790879,2021-01-12,CPD Tuition Reimbursement
57.0,2021-01-21,"MIKHAIL, ZAYA E",10532462.0,PV57205790880,1,3750.0,205790880,2021-01-12,CPD Tuition Reimbursement
57.0,2021-01-21,"MINX, DANIEL J",10512244.0,PV57205790881,1,2040.0,205790881,2021-01-12,CPD Tuition Reimbursement
57.0,2021-01-21,"MORIARTY, PATRICK",10558038.0,PV57205790882,1,2047.5,205790882,2021-01-12,CPD Tuition Reimbursement
57.0,2021-01-21,"MOSQUERA, SANDRA L",10551430.0,PV57205790883,1,3870.0,205790883,2021-01-12,CPD Tuition Reimbursement
57.0,2021-01-21,"MOY, ANDY T",10551424.0,PV57205790884,1,3870.0,205790884,2021-01-12,CPD Tuition Reimbursement
57.0,2021-01-21,"MURARSHEED, JAMAL H",10532464.0,PV57205790885,1,3750.0,205790885,2021-01-12,CPD Tuition Reimbursement
57.0,2021-01-21,"MURILLO, ELIZABETH",10551423.0,PV57205790886,1,960.0,205790886,2021-01-12,CPD Tuition Reimbursement
57.0,2021-01-21,"MURPHY, ROBERT A",50075740.0,PV57205790887,1,1800.0,205790887,2021-01-12,CPD Tuition Reimbursement
57.0,2021-01-21,"NAVARRO, MARELYN T",10551421.0,PV57205790888,1,2635.0,205790888,2021-01-12,CPD Tuition Reimbursement
57.0,2021-01-21,"NEELY, SHANEY",10555613.0,PV57205790889,1,2880.0,205790889,2021-01-12,CPD Tuition Reimbursement
57.0,2021-01-21,"NIETO, GUILEBALDO",10544299.0,PV57205790890,1,2880.0,205790890,2021-01-12,CPD Tuition Reimbursement
57.0,2021-01-21,"ONTIVEROS, GENA",50102850.0,PV57205790891,1,2997.0,205790891,2021-01-12,CPD Tuition Reimbursement
57.0,2021-01-21,"ORTIZ, PEDRO",10512233.0,PV57205790892,1,3840.0,205790892,2021-01-12,CPD Tuition Reimbursement
57.0,2021-01-21,"OWENS, RAYMOND",10236696.0,PV57205790893,1,2640.0,205790893,2021-01-12,CPD Tuition Reimbursement
57.0,2021-01-21,"PALIKIJ, MICHAEL",10512232.0,PV57205790894,1,3840.0,205790894,2021-01-12,CPD Tuition Reimbursement
57.0,2021-01-21,"PARKER, ROBBIN R",50075280.0,PV57205790895,1,1280.0,205790895,2021-01-12,CPD Tuition Reimbursement
57.0,2021-01-21,"PEREZ, BRANDON N",10551412.0,PV57205790897,1,1935.0,205790897,2021-01-12,CPD Tuition Reimbursement
57.0,2021-01-21,"PEREZ, ISAIAH",10557515.0,PV57205790896,1,2400.0,205790896,2021-01-12,CPD Tuition Reimbursement
57.0,2021-01-21,"PHILLIPS, ANTONIO",10551414.0,PV57205790899,1,3870.0,205790899,2021-01-12,CPD Tuition Reimbursement
57.0,2021-01-21,"PIECYK, ANDREW",10544326.0,PV57205790900,1,1920.0,205790900,2021-01-12,CPD Tuition Reimbursement
57.0,2021-01-21,"PRUGER, ROCCO R",55425024.0,PV57205790901,1,3780.0,205790901,2021-01-12,CPD Tuition Reimbursement
57.0,2021-01-21,"RASCHKE, WAYNE H",10135513.0,PV57205790902,1,3870.0,205790902,2021-01-12,CPD Tuition Reimbursement
57.0,2021-01-21,"REED, SCOTT",10551409.0,PV57205790903,1,3645.0,205790903,2021-01-12,CPD Tuition Reimbursement
57.0,2021-01-21,"REIFF, CAMERON",10547326.0,PV57205790904,1,2982.0,205790904,2021-01-12,CPD Tuition Reimbursement
57.0,2021-01-21,"REITZ, STEVEN",10179933.0,PV57205790905,1,3645.0,205790905,2021-01-12,CPD Tuition Reimbursement
57.0,2021-01-21,"REYES, GUILLERMO",52146034.0,PV57205790906,1,2880.0,205790906,2021-01-12,CPD Tuition Reimbursement
57.0,2021-01-21,"RILEY, J'MAL",10555630.0,PV57205790907,1,2880.0,205790907,2021-01-12,CPD Tuition Reimbursement
57.0,2021-01-21,"ROBINSON-STANFORD, DEMETRIUS A",10551487.0,PV57205790908,1,2880.0,205790908,2021-01-12,CPD Tuition Reimbursement
57.0,2021-01-21,"SAAVEDRA, JESUS",10557522.0,PV57205790909,1,945.0,205790909,2021-01-12,CPD Tuition Reimbursement
57.0,2021-01-21,"SALDIVAR, SANDY",10228772.0,PV57205790910,1,2400.0,205790910,2021-01-12,CPD Tuition Reimbursement
57.0,2021-01-21,"SALDIVAR, SANDY",10228772.0,PV57205790911,1,4500.0,205790911,2021-01-12,CPD Tuition Reimbursement
57.0,2021-01-21,"SAUCEDO JR., RUBEN",10555629.0,PV57205790912,1,2880.0,205790912,2021-01-12,CPD Tuition Reimbursement
57.0,2021-01-21,"SHEVLIN, JOSEPH M",50075390.0,PV57205790913,1,8351.0,205790913,2021-01-12,CPD Tuition Reimbursement
57.0,2021-01-21,"SMITH, KIMBERLY A",53758021.0,PV57205790914,1,3570.0,205790914,2021-01-12,CPD Tuition Reimbursement
57.0,2021-01-21,"STACK, MICHAEL J",10512636.0,PV57205790915,1,4890.0,205790915,2021-01-12,CPD Tuition Reimbursement
57.0,2021-01-21,"STAKEN, MICHAEL",10532471.0,PV57205790916,1,3240.0,205790916,2021-01-12,CPD Tuition Reimbursement
57.0,2021-01-21,"THEODORE, PETER A",52347030.0,PV57205790917,1,6920.0,205790917,2021-01-12,CPD Tuition Reimbursement
57.0,2021-01-21,"THOMAS, TIMOTHY M",10547319.0,PV57205790918,1,3750.0,205790918,2021-01-12,CPD Tuition Reimbursement
57.0,2021-01-21,"TOBIN, RYNE",10190915.0,PV57205790919,1,4890.0,205790919,2021-01-12,CPD Tuition Reimbursement
57.0,2021-01-21,TORDAK S PERKINS,51282032.0,PV57205790898,1,2160.0,205790898,2021-01-12,CPD Tuition Reimbursement
57.0,2021-01-21,"TOTH, LOU",10551479.0,PV57205790920,1,2880.0,205790920,2021-01-12,CPD Tuition Reimbursement
57.0,2021-01-21,"TYLER, PIERRE",10551472.0,PV57205790921,1,3150.0,205790921,2021-01-12,CPD Tuition Reimbursement
57.0,2021-01-21,"UGARTE, RENE",10532473.0,PV57205790922,1,3750.0,205790922,2021-01-12,CPD Tuition Reimbursement
57.0,2021-01-21,"VITERI, ALLISON",10512641.0,PV57205790923,1,1920.0,205790923,2021-01-12,CPD Tuition Reimbursement
57.0,2021-01-21,"VO, ALEX C",10555618.0,PV57205790924,1,2880.0,205790924,2021-01-12,CPD Tuition Reimbursement
57.0,2021-01-21,"WALLACE, CURTIS L",10182365.0,PV57205790925,1,1920.0,205790925,2021-01-12,CPD Tuition Reimbursement
57.0,2021-01-21,WILLIAM A JOHNSON,50074785.0,PV57205790864,1,3870.0,205790864,2021-01-12,CPD Tuition Reimbursement
57.0,2021-01-21,"WILLIAMS, PIERRE",10555611.0,PV57205790926,1,2880.0,205790926,2021-01-12,CPD Tuition Reimbursement
57.0,2021-01-21,"ZAYAS, ALBERTO H",10182369.0,PV57205790928,1,3667.5,205790928,2021-01-12,CPD Tuition Reimbursement
57.0,2021-01-22,"BROOKS, GLEN",53069021.0,PV57205795265,1,160.86,GLENBROOKS_16DEC2020_160.86,2020-12-16,FACEBOOK GUN TURN-IN ANNOUNCEMENT
57.0,2021-01-22,"BROOKS, GLEN",53069021.0,PV57205795265,1,50.0,GLENBROOKS_16DEC2020_50.00,2020-12-16,TWITTER GUN TURN-IN ANNOUNCEMENT
57.0,2021-01-22,"CAPRONI, MAX A",10123923.0,PV55205500064,1,55.98,MAXCAPRONI_19OCT2020_55.98,2020-10-19,RENEWAL OF POLICE BOARD WEBSITE DOMAIN NAME CHICAGOPOLICEBOARD.ORG
57.0,2021-01-25,"FRITZSCHE, MARK",10515199.0,PV57205795291,1,1294.67,UNIVERSALD HELICOPTER TRAINING,2020-11-15,"UNIVERSAL HELICOPTER TRAINING DALLAS,TX 15-21NOV20"
57.0,2021-01-28,DALE POTTER JR,54600026.0,PV57205795261,1,60.0,DPOTTER_09SEPT2020_60,2020-09-30,T-MOBILE LAW ENFORCEMENT RELATIONS
57.0,2021-01-28,DALE POTTER JR,54600026.0,PV57205795261,1,60.0,DPOTTER_19OCT2020,2020-10-19,T-MOBILE LAW ENFORCEMENT REALTIONS
57.0,2021-02-03,"HESPE, BRADLEY A",10515198.0,PV57205795290,1,1363.16,HELICOPTER TRAINING,2020-11-30,"UNIVERSAL HELICOPTER TRAINING DALLAS,TX 16-20 NOV 2020"
57.0,2021-02-03,"MORENO, RAUL",10561096.0,PV57205795281,1,1680.54,RAUL MORENO_13-19DEC20_1680.54,2020-12-13,TRAVEL REIMBURSEMENT FOR UNIVERSAL HELICOPTER BELL TRAINING IN DALLAS TEXAS FROM 13-19DEC2020 13-19
57.0,2021-02-08,"BROOKS, GLEN",53069021.0,PV57205795282,1,14.14,GBROOKS_18DEC20_14.14,2020-12-18,GUN TURN-IN ANNOUNCEMENT
57.0,2021-02-08,"DELOLMO, EDGAR F",10134806.0,PV57205795284,1,500.0,EDELOLMO_30MAY20_500.00,2020-05-30,REIMBURSEMENT COST FOR DEMAGES TO THEIR EQUIPMENT-CIVIL COMMOTION CLAIM POLICE OFFICERS EQUIPMENT
57.0,2021-02-08,"RIVERA, CYNTHIA G",10560224.0,PV57205795283,1,31.2,CRIVERA_18NOV20_49.34,2020-11-18,3 CPD CHILDREN T-SHIRTS/THIN BLUE LINE CERAMIC ORNAMENT PERSONALIZED
57.0,2021-02-08,"RIVERA, CYNTHIA G",10560224.0,PV57205795283,2,63.42,CRIVERA_18NOV20_49.34,2020-11-18,3 CPD CHILDREN T-SHIRTS/THIN BLUE LINE CERAMIC ORNAMENT PERSONALIZED
57.0,2021-02-10,DAWN M MELCHERT,51557029.0,PV57205795288,1,500.0,DLOVE_30MAY2020_500.00,2020-05-30,REIMBURSEMENT COST FOR DAMAGES TO THEIR EQUIPMENTS-CIVIL COMMOTION POLICE OFFICERS EQUIPMENTS
57.0,2021-02-10,"O'BRIEN, KEVIN",10544300.0,PV57205795285,1,500.0,KOBRIEN_30MAY2020_500.00,2020-05-30,REIMBURSEMEN COST FOR DAMAGES TO THEIR EQUIPMENT-CIVIL COMMOTION POLICE OFFICERS EQUIPMENTS
57.0,2021-02-10,"TROGLIA, GERALD R",10193610.0,PV57205795286,1,500.0,GTROGLIA_30MAY2020_500.00,2020-05-30,REIMBURSEMENT COST FOR DAMAGES TO THEIR EQUIPMENT-CIVIL COMMOTION CLAIM POLICE OFFICERS EQUIPMENT
57.0,2021-02-10,"VOITIK, DYLAN S",10560845.0,PV57205795287,1,500.0,DVOITIK_30MAY2020_500.00,2020-05-30,REIMBURSEMENT COST FOR DAMAGES TO THEIR EQUIPMENT-CIVIL COMMOTION CLAIM POLICE OFFICERS EQUIPMENT
57.0,2021-02-12,"BOGYO, GREGORY R",10561312.0,PV57205795295,1,500.0,GBOGYO_30MAY2020_500.00,2020-05-30,REIMBURSEMENT COST FOR DAMAGES TO THEIR-CIVIL COMMOTION CLAIM POLICE OFFICERS EQUIPMENT
57.0,2021-02-12,"LONCAR, MARK",10561301.0,PV57205795289,1,500.0,MLONCAR_30MAY2020_500.00,2020-05-30,REIMBURSEMENY COST FOR DAMAGES TO THEIR EQUIPMENT-CIVIL COMMOTION CLAIM POLICE OFFICERS
57.0,2021-02-12,"MALINOWSKI, MICHAEL",10561311.0,PV57205795296,1,500.0,MMALINOWSKI_30MAY2020_500.00,2020-05-30,REIMBURSEMENT COST FOR DAMAGES TO THEIR EQUIPMENT
57.0,2021-02-12,"RIVERA JR, ROBERT",10561321.0,PV57205795297,1,500.0,RRIVERA_30MAY2020_500.00,2020-05-30,REIMBURSEMENT COST FOR DAMAGES TO THEIR EQUIPMENT
57.0,2021-02-17,"DOHERTY, DANIEL L",10561314.0,PV57205795304,1,500.0,DDOHERTY_30MAY2020_2020,2020-05-30,REIMBURSEMENT COST FOR DAMAGES TO THEIR EQUIPMENT
57.0,2021-02-17,"HEALY, MATTHEW R",10561320.0,PV57205795298,1,500.0,MHEALY_30MAY2020_500.00,2020-05-30,REIMBURSEMENT FOR COST FOR DAMAGES TO THEIR EQUIPMENT
57.0,2021-02-17,"LANG, KYLE",10561315.0,PV57205795303,1,500.0,KLANG_30MAY2020_500.00,2020-05-30,REIMBURSEMENT COST FOR DAMAGES TO THEIR EQUIPMENT
57.0,2021-02-17,"PEREZ GUZMAN, RICARDO",10561316.0,PV57205795302,1,500.0,RPEREZ_30MAY2020_500.00,2020-05-30,REIMBURSEMENT COST FOR DAMAGES TO THEIR EQUIPMENT
57.0,2021-02-17,"RODRIGUEZ, JULIO J",10561317.0,PV57205795301,1,500.0,JRODRIGUEZ_30MAY2020_500.00,2020-05-30,REIMBURSEMENT COST FOR DAMAGES TO THEIR EQUIPMENT
57.0,2021-02-17,"TOLEDO, PETER H",10561318.0,PV57205795300,1,500.0,PTOLEDO_30MAY2020_500.00,2020-05-30,REIMBURSEMENT COST FOR DAMAGES TO THEIR EQUIPMENT
57.0,2021-02-17,"VASILIADIS, TIMOTHY P",10561319.0,PV57205795299,1,500.0,TVASILIADIS_30MAY2020_500.00,2020-05-30,REIMBURSEMENT COST FOR DAMAGES TO THEIR EQUIPMENT
57.0,2021-02-23,"ARJMAND, SUSAN BERYL",10125850.0,PV57205795306,1,731.0,SARJMAND_5MAY2020_731.00,2020-05-05,RENEWAL OF DEA CERTIFICATE LICENSE REGISTRATION
57.0,2021-02-23,"DION, AMANDA M",10560725.0,PV57205795262,1,75.0,ADION_9NOV20,2020-11-11,FLORIDA CRIME AND INTELLIGENCE ANALYST-TRAINING REGISTRATION
57.0,2021-03-04,"ALVARADO, VICTOR M",10560792.0,PV57215790929,1,1980.0,215790929,2021-02-22,CPD Tuition Reimbursement
57.0,2021-03-04,"ALVAREZ, JAVIER",10551376.0,PV57215790930,1,3960.0,215790930,2021-02-22,CPD Tuition Reimbursement
57.0,2021-03-04,ANDREW THOMAS,10122835.0,PV57215791044,1,5244.75,215791044,2021-02-22,CPD Tuition Reimbursement
57.0,2021-03-04,ANTONIO J VALENTIN,50076029.0,PV57215791045,1,5244.75,215791045,2021-02-22,CPD Tuition Reimbursement
57.0,2021-03-04,"AVALOS, LLECENIA",10560796.0,PV57215790931,1,1980.0,215790931,2021-02-22,CPD Tuition Reimbursement
57.0,2021-03-04,"BAUTISTA, JOSE",10512073.0,PV57215790932,1,2880.0,215790932,2021-02-22,CPD Tuition Reimbursement
57.0,2021-03-04,"BECHINA, LUKE S",10557525.0,PV57215790933,1,4080.0,215790933,2021-02-22,CPD Tuition Reimbursement
57.0,2021-03-04,"BETZ, JUSTIN",10512044.0,PV57215790934,1,3840.0,215790934,2021-02-22,CPD Tuition Reimbursement
57.0,2021-03-04,"BIGGANE, JOSEPH K",10551393.0,PV57215790935,1,3840.0,215790935,2021-02-22,CPD Tuition Reimbursement
57.0,2021-03-04,"BLAIR, KEITH A",10220993.0,PV57215790936,1,3930.0,215790936,2021-02-22,CPD Tuition Reimbursement
57.0,2021-03-04,"BLAS, NIDIA E",10512048.0,PV57215790937,1,3840.0,215790937,2021-02-22,CPD Tuition Reimbursement
57.0,2021-03-04,"BLAS, NIDIA E",10512048.0,PV57215790938,1,3840.0,215790938,2021-02-22,CPD Tuition Reimbursement
57.0,2021-03-04,"BOKOWSKI, WILLIAM J",10551394.0,PV57215790939,1,3870.0,215790939,2021-02-22,CPD Tuition Reimbursement
57.0,2021-03-04,"BOSSARD, KYLIE T",10555554.0,PV57215790940,1,3840.0,215790940,2021-02-22,CPD Tuition Reimbursement
57.0,2021-03-04,"BOWERY, PATRICK T",10236239.0,PV57215790941,1,1920.0,215790941,2021-02-22,CPD Tuition Reimbursement
57.0,2021-03-04,"BOWERY, PATRICK T",10236239.0,PV57215790942,1,1920.0,215790942,2021-02-22,CPD Tuition Reimbursement
57.0,2021-03-04,"BRANDOLINO, BRIAN W",10512060.0,PV57215790943,1,3360.0,215790943,2021-02-22,CPD Tuition Reimbursement
57.0,2021-03-04,"BROOKS, MALCOLM D",10551392.0,PV57215790944,1,3840.0,215790944,2021-02-22,CPD Tuition Reimbursement
57.0,2021-03-04,"BROWN, ALEXUS J",10553484.0,PV57215790946,1,3870.0,215790946,2021-02-22,CPD Tuition Reimbursement
57.0,2021-03-04,"BROWN, MARCUS A",10560789.0,PV57215790945,1,3840.0,215790945,2021-02-22,CPD Tuition Reimbursement
57.0,2021-03-04,"BUDZ, JEFFREY",10553486.0,PV57215790947,1,3870.0,215790947,2021-02-22,CPD Tuition Reimbursement
57.0,2021-03-04,"BUTLER, KAREEM S",10551457.0,PV57215790948,1,3840.0,215790948,2021-02-22,CPD Tuition Reimbursement
57.0,2021-03-04,"CAMPBELL, MICHAEL P",10551459.0,PV57215790950,1,3870.0,215790950,2021-02-22,CPD Tuition Reimbursement
57.0,2021-03-04,"CARDENAS, ROSA",10560790.0,PV57215790951,1,3840.0,215790951,2021-02-22,CPD Tuition Reimbursement
57.0,2021-03-04,"CARNEY, MATTHEW",10558074.0,PV57215790952,1,4495.5,215790952,2021-02-22,CPD Tuition Reimbursement
57.0,2021-03-04,"CARTER, ANGELA LA SHEAKE",10512056.0,PV57215790953,1,3750.0,215790953,2021-02-22,CPD Tuition Reimbursement
57.0,2021-03-04,CASSIE WEST,10122848.0,PV57215791048,1,3840.0,215791048,2021-02-22,CPD Tuition Reimbursement
57.0,2021-03-04,"CENTENO, HECTOR L",10236241.0,PV57215790954,1,3663.0,215790954,2021-02-22,CPD Tuition Reimbursement
57.0,2021-03-04,"CENTENO, HECTOR L",10236241.0,PV57215790955,1,5145.0,215790955,2021-02-22,CPD Tuition Reimbursement
57.0,2021-03-04,"CHATYS, MARTIN",10205411.0,PV57215790956,1,3840.0,215790956,2021-02-22,CPD Tuition Reimbursement
57.0,2021-03-04,"CLAUDIO, ERIBERTO",10232447.0,PV57215790957,1,5160.0,215790957,2021-02-22,CPD Tuition Reimbursement
57.0,2021-03-04,"CONRAD, ROBERT S",50648025.0,PV57215790958,1,3930.0,215790958,2021-02-22,CPD Tuition Reimbursement
57.0,2021-03-04,"CURRAN, ROBERT",10193538.0,PV57215790959,1,4725.0,215790959,2021-02-22,CPD Tuition Reimbursement
57.0,2021-03-04,"DANIELS, KRISTEN T",10553492.0,PV57215790960,1,3777.75,215790960,2021-02-22,CPD Tuition Reimbursement
57.0,2021-03-04,"DELGADO FERNANDEZ, ENRIQUE",10228754.0,PV57215790961,1,2247.75,215790961,2021-02-22,CPD Tuition Reimbursement
57.0,2021-03-04,"DEMIROVIC, DERVIS",10560805.0,PV57215790962,1,3960.0,215790962,2021-02-22,CPD Tuition Reimbursement
57.0,2021-03-04,"DIARRA, MAMADOU",10551446.0,PV57215790963,1,3360.0,215790963,2021-02-22,CPD Tuition Reimbursement
57.0,2021-03-04,"DOMICO JR, JEROME A",10512068.0,PV57215790964,1,3750.0,215790964,2021-02-22,CPD Tuition Reimbursement
57.0,2021-03-04,"DRISH, JAMES",10175577.0,PV57215790965,1,1935.0,215790965,2021-02-22,CPD Tuition Reimbursement
57.0,2021-03-04,"DRUMGOOLE, KEVIN",1071667.0,PV57215790966,1,1875.0,215790966,2021-02-22,CPD Tuition Reimbursement
57.0,2021-03-04,"DUNN, DANIELLE",10544249.0,PV57215790967,1,3360.0,215790967,2021-02-22,CPD Tuition Reimbursement
57.0,2021-03-04,"DUPLESSIS, MATTHEW",10551440.0,PV57215790968,1,3870.0,215790968,2021-02-22,CPD Tuition Reimbursement
57.0,2021-03-04,"DURKIN, MICHAEL J",10532454.0,PV57215790969,1,4495.5,215790969,2021-02-22,CPD Tuition Reimbursement
57.0,2021-03-04,"ELLIOTT, WILLIAM S",10553494.0,PV57215790970,1,966.0,215790970,2021-02-22,CPD Tuition Reimbursement
57.0,2021-03-04,EMILY C CAMPBELL,50107368.0,PV57215790949,1,5160.0,215790949,2021-02-22,CPD Tuition Reimbursement
57.0,2021-03-04,"ESCALANTE, EDUARDO",10551453.0,PV57215790971,1,3840.0,215790971,2021-02-22,CPD Tuition Reimbursement
57.0,2021-03-04,"EVANS, JERMAINE",10544250.0,PV57215790972,1,3840.0,215790972,2021-02-22,CPD Tuition Reimbursement
57.0,2021-03-04,"EVANS, MATTHEW T",53552021.0,PV57215790973,1,499.5,215790973,2021-02-22,CPD Tuition Reimbursement
57.0,2021-03-04,"FATIGATI, JAMES",10544251.0,PV57215790974,1,3840.0,215790974,2021-02-22,CPD Tuition Reimbursement
57.0,2021-03-04,"FLETCHER, NOLAN",10512063.0,PV57215790975,1,1440.0,215790975,2021-02-22,CPD Tuition Reimbursement
57.0,2021-03-04,"FLORES, GABRIEL",10560808.0,PV57215790976,1,2040.0,215790976,2021-02-22,CPD Tuition Reimbursement
57.0,2021-03-04,"FLYNN, KEVIN P",10232459.0,PV57215790977,1,3750.0,215790977,2021-02-22,CPD Tuition Reimbursement
57.0,2021-03-04,"FORBES, PATRICK W",10154619.0,PV57215790978,1,3840.0,215790978,2021-02-22,CPD Tuition Reimbursement
57.0,2021-03-04,"FOSTER, MARK S",10512064.0,PV57215790979,1,3750.0,215790979,2021-02-22,CPD Tuition Reimbursement
57.0,2021-03-04,"GALLARDO, SAUL",52563024.0,PV57215790980,1,3027.5,215790980,2021-02-22,CPD Tuition Reimbursement
57.0,2021-03-04,"GARDNER, KEITH",10551436.0,PV57215790981,1,3870.0,215790981,2021-02-22,CPD Tuition Reimbursement
57.0,2021-03-04,"GIANFRANCISCO, ALFONSO D",10193649.0,PV57215790982,1,4890.0,215790982,2021-02-22,CPD Tuition Reimbursement
57.0,2021-03-04,"GOLAB, KAMIL K",10512041.0,PV57215790983,1,3750.0,215790983,2021-02-22,CPD Tuition Reimbursement
57.0,2021-03-04,"GOMEZ, JOSE",10555572.0,PV57215790984,1,3840.0,215790984,2021-02-22,CPD Tuition Reimbursement
57.0,2021-03-04,"GONZALEZ, ALEXANDER",10560851.0,PV57215790986,1,3960.0,215790986,2021-02-22,CPD Tuition Reimbursement
57.0,2021-03-04,"GORMAN, EDWIN M",10512042.0,PV57215790987,1,3630.0,215790987,2021-02-22,CPD Tuition Reimbursement
57.0,2021-03-04,"GROSS, JENNIFER",10238007.0,PV57215790988,1,7260.0,215790988,2021-02-22,CPD Tuition Reimbursement
57.0,2021-03-04,"GURYK, YAROSLAV",10228762.0,PV57215790989,1,2155.34,215790989,2021-02-22,CPD Tuition Reimbursement
57.0,2021-03-04,"GUTIERREZ, SYLVIA",10557533.0,PV57215790990,1,3840.0,215790990,2021-02-22,CPD Tuition Reimbursement
57.0,2021-03-04,"GUZMAN, DANNY",10555593.0,PV57215790991,1,3360.0,215790991,2021-02-22,CPD Tuition Reimbursement
57.0,2021-03-04,"GUZMAN, DANNY",10555593.0,PV57215790992,1,2880.0,215790992,2021-02-22,CPD Tuition Reimbursement
57.0,2021-03-04,"HASENFANG, KEVIN",10551441.0,PV57215790993,1,2765.0,215790993,2021-02-22,CPD Tuition Reimbursement
57.0,2021-03-04,"HERNANDEZ, VINCENT",10560858.0,PV57215790994,1,3840.0,215790994,2021-02-22,CPD Tuition Reimbursement
57.0,2021-03-04,"HERRERA, GERARDO",10558075.0,PV57215790995,1,3960.0,215790995,2021-02-22,CPD Tuition Reimbursement
57.0,2021-03-04,"HOLLAND, LESLIE R",10512192.0,PV57215790996,1,3750.0,215790996,2021-02-22,CPD Tuition Reimbursement
57.0,2021-03-04,"HUGHES, MICHAEL D",10553500.0,PV57215790997,1,3870.0,215790997,2021-02-22,CPD Tuition Reimbursement
57.0,2021-03-04,"INSLEY, GREGORY J",10551404.0,PV57215790998,1,3870.0,215790998,2021-02-22,CPD Tuition Reimbursement
57.0,2021-03-04,"IQBAL, RAFIA",10555610.0,PV57215790999,1,2880.0,215790999,2021-02-22,CPD Tuition Reimbursement
57.0,2021-03-04,"IQBAL, RAFIA",10555610.0,PV57215791000,1,3840.0,215791000,2021-02-22,CPD Tuition Reimbursement
57.0,2021-03-04,"JACKSON, LEE",10512205.0,PV57215791001,1,1920.0,215791001,2021-02-22,CPD Tuition Reimbursement
57.0,2021-03-04,"JADOU, GEORGE",10551399.0,PV57215791002,1,3870.0,215791002,2021-02-22,CPD Tuition Reimbursement
57.0,2021-03-04,"JAYCOX, SEAN P",10547343.0,PV57215791003,1,4080.0,215791003,2021-02-22,CPD Tuition Reimbursement
57.0,2021-03-04,"JOHNSON, DANIEL A",10532459.0,PV57215791004,1,3750.0,215791004,2021-02-22,CPD Tuition Reimbursement
57.0,2021-03-04,"JOHNSON, JOHN",10544260.0,PV57215791005,1,4495.5,215791005,2021-02-22,CPD Tuition Reimbursement
57.0,2021-03-04,"JOHNSON, WARREN D",10128871.0,PV57215791006,1,1980.0,215791006,2021-02-22,CPD Tuition Reimbursement
57.0,2021-03-04,"JONES, ERIN E",10132158.0,PV57215791007,1,3840.0,215791007,2021-02-22,CPD Tuition Reimbursement
57.0,2021-03-04,"JOSEPHS, PATRICK R",10189220.0,PV57215791008,1,2425.95,215791008,2021-02-22,CPD Tuition Reimbursement
57.0,2021-03-04,"KACZMAREK, JOSEPH M",10512203.0,PV57215791009,1,2803.79,215791009,2021-02-22,CPD Tuition Reimbursement
57.0,2021-03-04,"KASPRZAK, DAWID",10544277.0,PV57215791010,1,3840.0,215791010,2021-02-22,CPD Tuition Reimbursement
57.0,2021-03-04,"KREHER, LAUREN P",10547323.0,PV57215791011,1,1236.6,215791011,2021-02-22,CPD Tuition Reimbursement
57.0,2021-03-04,"KRZYZYK, NIKA M",10553503.0,PV57215791012,1,4080.0,215791012,2021-02-22,CPD Tuition Reimbursement
57.0,2021-03-04,"KUBIAK, CAROLYN S",10512191.0,PV57215791013,1,3840.0,215791013,2021-02-22,CPD Tuition Reimbursement
57.0,2021-03-04,"KUTYLOWSKI, MARIUSZ",10551405.0,PV57215791014,1,1563.75,215791014,2021-02-22,CPD Tuition Reimbursement
57.0,2021-03-04,"LEE, JOSHUA S",10553505.0,PV57215791015,1,3746.25,215791015,2021-02-22,CPD Tuition Reimbursement
57.0,2021-03-04,"LENNHARDT, MEGHAN R",10557508.0,PV57215791016,1,1260.0,215791016,2021-02-22,CPD Tuition Reimbursement
57.0,2021-03-04,"LOBURGIO, ANTHONY M",10228748.0,PV57215791017,1,3746.25,215791017,2021-02-22,CPD Tuition Reimbursement
57.0,2021-03-04,"LUCAS, JAIRO",10555568.0,PV57215791018,1,2880.0,215791018,2021-02-22,CPD Tuition Reimbursement
57.0,2021-03-04,"MINX, DANIEL J",10512244.0,PV57215791019,1,4080.0,215791019,2021-02-22,CPD Tuition Reimbursement
57.0,2021-03-04,"MIZERA, JACQUELINE M",10189229.0,PV57215791020,1,2040.0,215791020,2021-02-22,CPD Tuition Reimbursement
57.0,2021-03-04,"MOTA, FLAVIO",50093971.0,PV57215791021,1,3419.25,215791021,2021-02-22,CPD Tuition Reimbursement
57.0,2021-03-04,"MUNIZ, ALEXANDER",10236695.0,PV57215791022,1,2247.75,215791022,2021-02-22,CPD Tuition Reimbursement
57.0,2021-03-04,"MURILLO, ELIZABETH",10551423.0,PV57215791023,1,1920.0,215791023,2021-02-22,CPD Tuition Reimbursement
57.0,2021-03-04,"MYKHNYCH, ILONA",10553513.0,PV57215791024,1,2442.0,215791024,2021-02-22,CPD Tuition Reimbursement
57.0,2021-03-04,"PARKER, ROBBIN R",50075280.0,PV57215791025,1,640.0,215791025,2021-02-22,CPD Tuition Reimbursement
57.0,2021-03-04,"PAULSON, RACHEL M",10512567.0,PV57215791026,1,4495.5,215791026,2021-02-22,CPD Tuition Reimbursement
57.0,2021-03-04,"REED, RONALD J",10122859.0,PV57215791028,1,1530.0,215791028,2021-02-22,CPD Tuition Reimbursement
57.0,2021-03-04,"REED, SCOTT",10551409.0,PV57215791027,1,1215.0,215791027,2021-02-22,CPD Tuition Reimbursement
57.0,2021-03-04,"REGALADO, ANTHONY",10555625.0,PV57215791029,1,4495.5,215791029,2021-02-22,CPD Tuition Reimbursement
57.0,2021-03-04,"REYES JR, MARIO",10227130.0,PV57215791030,1,4495.5,215791030,2021-02-22,CPD Tuition Reimbursement
57.0,2021-03-04,"ROBERTS, BRENDAN D",10555621.0,PV57215791031,1,2880.0,215791031,2021-02-22,CPD Tuition Reimbursement
57.0,2021-03-04,"RODRIGUEZ BOYER, CARLA M",10228768.0,PV57215791032,1,438.0,215791032,2021-02-22,CPD Tuition Reimbursement
57.0,2021-03-04,"SALGADO, BETHANY S",10555627.0,PV57215791034,1,2385.0,215791034,2021-02-22,CPD Tuition Reimbursement
57.0,2021-03-04,"SALINAS, STEVEN",10555628.0,PV57215791035,1,2880.0,215791035,2021-02-22,CPD Tuition Reimbursement
57.0,2021-03-04,"SANFILIPPO, VINCENT A",10544331.0,PV57215791036,1,4495.5,215791036,2021-02-22,CPD Tuition Reimbursement
57.0,2021-03-04,"SCHMITT, MARK",50119037.0,PV57215791037,1,2595.0,215791037,2021-02-22,CPD Tuition Reimbursement
57.0,2021-03-04,"SCOTT, DARRICK E",10182348.0,PV57215791038,1,5240.0,215791038,2021-02-22,CPD Tuition Reimbursement
57.0,2021-03-04,"SHEETZ, KEVIN M",50076217.0,PV57215791039,1,2400.0,215791039,2021-02-22,CPD Tuition Reimbursement
57.0,2021-03-04,"SIERZEGA, WILLIAM",10232452.0,PV57215791040,1,5135.63,215791040,2021-02-22,CPD Tuition Reimbursement
57.0,2021-03-04,"SLEDGE, MICHELANGE",50076105.0,PV57215791041,1,1965.0,215791041,2021-02-22,CPD Tuition Reimbursement
57.0,2021-03-04,"SMITH, KIMBERLY A",53758021.0,PV57215791042,1,4080.0,215791042,2021-02-22,CPD Tuition Reimbursement
57.0,2021-03-04,"STAWICKI, CHRISTOPHER",10190927.0,PV57215791043,1,2040.0,215791043,2021-02-22,CPD Tuition Reimbursement
57.0,2021-03-04,TAKIA D WASHINGTON,50722025.0,PV57215791047,1,5135.0,215791047,2021-02-22,CPD Tuition Reimbursement
57.0,2021-03-04,"WALKER, ERIC M",50076017.0,PV57215791046,1,3525.0,215791046,2021-02-22,CPD Tuition Reimbursement
57.0,2021-03-04,"WESSELHOFF, MELISSA K",10134817.0,PV57215791033,1,4495.5,215791033,2021-02-22,CPD Tuition Reimbursement
57.0,2021-03-04,"WILLIAMS, RAMONA S",10148547.0,PV57215791049,1,4080.0,215791049,2021-02-22,CPD Tuition Reimbursement
57.0,2021-03-04,"YOUNG, CAROLYN M",53752022.0,PV57215791050,1,2997.0,215791050,2021-02-22,CPD Tuition Reimbursement
57.0,2021-03-10,"MARTINEZ, RAFAEL",10544283.0,PV57195790677,1,1880.0,195790677,2019-08-07,CPD Tuition Reimbursement
57.0,2021-03-12,"RANIERE, BRIAN P",10124724.0,PV57215700024,1,1421.8,"FORT WORTH, TX/26-30 JAN 2021",2021-03-09,"REIMBURSEMENT BELL HELICOPTER TRAINING/FORT WORTH, TX/26-30 JAN 2021"
57.0,2021-03-15,ELIZABETH C SCHULTZ,50785049.0,PV57215700026,1,200.0,ESHULTZ_4MAR2021_200,2021-03-04,2021 IACP OFFICER SAFETY AND WELLNESS SYMPOSIUM
57.0,2021-03-22,ANDRE FRIERSON,51558030.0,PV57215791084,1,3780.0,215791084,2021-03-15,CPD Tuition Reimbursement
57.0,2021-03-22,ANGELA MC LAURIN,53555024.0,PV57215791130,1,3930.0,215791130,2021-03-15,CPD Tuition Reimbursement
57.0,2021-03-22,"ANGUIANO, CECILIA",10551380.0,PV57215791051,1,5130.0,215791051,2021-03-15,CPD Tuition Reimbursement
57.0,2021-03-22,"ARROYO, ARACELI",10560791.0,PV57215791052,1,5130.0,215791052,2021-03-15,CPD Tuition Reimbursement
57.0,2021-03-22,"ASHE, COLLEEN E",10551386.0,PV57215791053,1,1896.0,215791053,2021-03-15,CPD Tuition Reimbursement
57.0,2021-03-22,"BAKER, MICHAEL N",50079383.0,PV57215791054,1,4080.0,215791054,2021-03-15,CPD Tuition Reimbursement
57.0,2021-03-22,"BENAMON, MICHAEL",10193529.0,PV57215791055,1,3780.0,215791055,2021-03-15,CPD Tuition Reimbursement
57.0,2021-03-22,"BENTON, KERRY K",10228728.0,PV57215791056,1,1260.0,215791056,2021-03-15,CPD Tuition Reimbursement
57.0,2021-03-22,"BERNAL, ALONSO",10560793.0,PV57215791057,1,4275.0,215791057,2021-03-15,CPD Tuition Reimbursement
57.0,2021-03-22,"BICKHAM, TIMOTHY M",10232446.0,PV57215791058,1,4644.0,215791058,2021-03-15,CPD Tuition Reimbursement
57.0,2021-03-22,"BIRD, JOSEPH J",10189958.0,PV57215791059,1,10000.0,215791059,2021-03-15,CPD Tuition Reimbursement
57.0,2021-03-22,"BIRT, DANIEL",10551395.0,PV57215791060,1,5130.0,215791060,2021-03-15,CPD Tuition Reimbursement
57.0,2021-03-22,"BOLINE, PATRICK",10547346.0,PV57215791061,1,1498.5,215791061,2021-03-15,CPD Tuition Reimbursement
57.0,2021-03-22,"BOYLE, NICHOLAS",10558017.0,PV57215791062,1,5130.0,215791062,2021-03-15,CPD Tuition Reimbursement
57.0,2021-03-22,BRYAN A SPREYNE,50076052.0,PV57215791199,1,5040.0,215791199,2021-03-15,CPD Tuition Reimbursement
57.0,2021-03-22,"BRYANT, JALISA E",10553485.0,PV57215791064,1,3150.0,215791064,2021-03-15,CPD Tuition Reimbursement
57.0,2021-03-22,"BUTLER, KAREEM S",10551457.0,PV57215791065,1,2880.0,215791065,2021-03-15,CPD Tuition Reimbursement
57.0,2021-03-22,CARL IBARRA,52339024.0,PV57215791095,1,5130.0,215791095,2021-03-15,CPD Tuition Reimbursement
57.0,2021-03-22,CASSIE WEST,10122848.0,PV57215791219,1,2640.0,215791219,2021-03-15,CPD Tuition Reimbursement
57.0,2021-03-22,"CESPEDES, ERIC",10182304.0,PV57215791066,1,4488.75,215791066,2021-03-15,CPD Tuition Reimbursement
57.0,2021-03-22,"CHAPA, ROBERTA",10189208.0,PV57215791067,1,5130.0,215791067,2021-03-15,CPD Tuition Reimbursement
57.0,2021-03-22,"COLLINS, MICHAEL K",51788021.0,PV57215791068,1,5130.0,215791068,2021-03-15,CPD Tuition Reimbursement
57.0,2021-03-22,"DANIELS, KRISTEN T",10553492.0,PV57215791069,1,4495.5,215791069,2021-03-15,CPD Tuition Reimbursement
57.0,2021-03-22,"DE LA HUERTA, VANESSA",10190929.0,PV57215791072,1,3667.5,215791072,2021-03-15,CPD Tuition Reimbursement
57.0,2021-03-22,"DE LA MORA, MARIA V",10512067.0,PV57215791138,1,3750.0,215791138,2021-03-15,CPD Tuition Reimbursement
57.0,2021-03-22,"DE LA O, DAVID",10232448.0,PV57215791073,1,5130.0,215791073,2021-03-15,CPD Tuition Reimbursement
57.0,2021-03-22,"DELATORRE, MARIA E",10547348.0,PV57215791074,1,584.0,215791074,2021-03-15,CPD Tuition Reimbursement
57.0,2021-03-22,"DELGADO, ROLANDO",10547350.0,PV57215791075,1,2263.92,215791075,2021-03-15,CPD Tuition Reimbursement
57.0,2021-03-22,"DELUNA JR, GONZALO",51016023.0,PV57215791076,1,2520.0,215791076,2021-03-15,CPD Tuition Reimbursement
57.0,2021-03-22,"DOMINGUEZ, YANEIRE",10236248.0,PV57215791077,1,3870.0,215791077,2021-03-15,CPD Tuition Reimbursement
57.0,2021-03-22,"DWORAKOWSKI, CHRISTOPHER",10220792.0,PV57215791078,1,5130.0,215791078,2021-03-15,CPD Tuition Reimbursement
57.0,2021-03-22,"ELKHDAIJI, ABDELLAH",10560804.0,PV57215791079,1,2096.22,215791079,2021-03-15,CPD Tuition Reimbursement
57.0,2021-03-22,EMANUEL MUHAMMAD,10122428.0,PV57215791141,1,5130.0,215791141,2021-03-15,CPD Tuition Reimbursement
57.0,2021-03-22,"EVANS, FRANCIS G",54313021.0,PV57215791080,1,9680.0,215791080,2021-03-15,CPD Tuition Reimbursement
57.0,2021-03-22,"EVANS, MATTHEW T",53552021.0,PV57215700033,1,300.0,MEVANS-16OCT20_300.00,2020-10-16,CELL DATA
57.0,2021-03-22,"FELICIANO, IVAN",10544252.0,PV57215791081,1,2400.0,215791081,2021-03-15,CPD Tuition Reimbursement
57.0,2021-03-22,"FLORES, DANIELLE",10553496.0,PV57215791082,1,3780.0,215791082,2021-03-15,CPD Tuition Reimbursement
57.0,2021-03-22,"FORBES, PATRICK W",10154619.0,PV57215791083,1,2880.0,215791083,2021-03-15,CPD Tuition Reimbursement
57.0,2021-03-22,"GALLARDO, SAUL",52563024.0,PV57215791085,1,327.5,215791085,2021-03-15,CPD Tuition Reimbursement
57.0,2021-03-22,"GAMA JR, GUILLERMO",10236250.0,PV57215791086,1,3870.0,215791086,2021-03-15,CPD Tuition Reimbursement
57.0,2021-03-22,"GARCIA, ADOLFO",10544254.0,PV57215791087,1,3667.5,215791087,2021-03-15,CPD Tuition Reimbursement
57.0,2021-03-22,"GODINEZ, ANTONIO",10558076.0,PV57215791088,1,5130.0,215791088,2021-03-15,CPD Tuition Reimbursement
57.0,2021-03-22,"GOLEN, PAUL",10551400.0,PV57215791089,1,5400.0,215791089,2021-03-15,CPD Tuition Reimbursement
57.0,2021-03-22,"GOMEZ, ALEC",10236253.0,PV57215791090,1,2247.75,215791090,2021-03-15,CPD Tuition Reimbursement
57.0,2021-03-22,"GUZMAN, LISA",10560854.0,PV57215791091,1,5130.0,215791091,2021-03-15,CPD Tuition Reimbursement
57.0,2021-03-22,"HASAN, KHALED",10551434.0,PV57215791092,1,3780.0,215791092,2021-03-15,CPD Tuition Reimbursement
57.0,2021-03-22,"HERRERA, SERGIO",10551439.0,PV57215791093,1,3870.0,215791093,2021-03-15,CPD Tuition Reimbursement
57.0,2021-03-22,"HINK, MICHAEL",10199077.0,PV57215791094,1,3630.0,215791094,2021-03-15,CPD Tuition Reimbursement
57.0,2021-03-22,"JEFFERSON, ALLEN",10532457.0,PV57215791096,1,1575.0,215791096,2021-03-15,CPD Tuition Reimbursement
57.0,2021-03-22,"JEFFRIES, JAMES F",10193554.0,PV57215791097,1,3667.5,215791097,2021-03-15,CPD Tuition Reimbursement
57.0,2021-03-22,"KANDEL, AMBER A",10557516.0,PV57215791099,1,1125.0,215791099,2021-03-15,CPD Tuition Reimbursement
57.0,2021-03-22,"KANDEL, AMBER A",10557516.0,PV57215791100,1,1312.5,215791100,2021-03-15,CPD Tuition Reimbursement
57.0,2021-03-22,"KAZMI, SYED M",10561452.0,PV57215791101,1,3840.0,215791101,2021-03-15,CPD Tuition Reimbursement
57.0,2021-03-22,"KHIO, PETER J",10560849.0,PV57215791102,1,1980.0,215791102,2021-03-15,CPD Tuition Reimbursement
57.0,2021-03-22,"KILLEN, KEVIN M",10560844.0,PV57215791103,1,3960.0,215791103,2021-03-15,CPD Tuition Reimbursement
57.0,2021-03-22,"KINSEY JR, GEORGE R",10227103.0,PV57215791104,1,5130.0,215791104,2021-03-15,CPD Tuition Reimbursement
57.0,2021-03-22,"KLIMASARA, JEREMY",10551418.0,PV57215791105,1,3870.0,215791105,2021-03-15,CPD Tuition Reimbursement
57.0,2021-03-22,"LACNY, NICHOLAS A",51014050.0,PV57215791106,1,3960.0,215791106,2021-03-15,CPD Tuition Reimbursement
57.0,2021-03-22,"LASTER, ERIC",10544278.0,PV57215791107,1,720.0,215791107,2021-03-15,CPD Tuition Reimbursement
57.0,2021-03-22,"LEMON, TAMARA O",10190933.0,PV57215791108,1,3750.0,215791108,2021-03-15,CPD Tuition Reimbursement
57.0,2021-03-22,"LENNHARDT, MEGHAN R",10557508.0,PV57215791109,1,2205.0,215791109,2021-03-15,CPD Tuition Reimbursement
57.0,2021-03-22,"LIPMAN, KEVIN",10553506.0,PV57215791111,1,1848.0,215791111,2021-03-15,CPD Tuition Reimbursement
57.0,2021-03-22,"LOMBARDI, SARAH F",10193561.0,PV57215791112,1,3840.0,215791112,2021-03-15,CPD Tuition Reimbursement
57.0,2021-03-22,"LOPEZ, ANGELINA",10557514.0,PV57215791113,1,2263.92,215791113,2021-03-15,CPD Tuition Reimbursement
57.0,2021-03-22,"LUCAS, JAIRO",10555568.0,PV57215791114,1,3840.0,215791114,2021-03-15,CPD Tuition Reimbursement
57.0,2021-03-22,"LYONS, BRENDAN D",10558023.0,PV57215791115,1,5130.0,215791115,2021-03-15,CPD Tuition Reimbursement
57.0,2021-03-22,"MACDONALD, LAURA",10512253.0,PV57215791116,1,3840.0,215791116,2021-03-15,CPD Tuition Reimbursement
57.0,2021-03-22,"MACIAS, CHRISTINA A",10553507.0,PV57215791117,1,3870.0,215791117,2021-03-15,CPD Tuition Reimbursement
57.0,2021-03-22,"MALONE, NICHOLAS",10175605.0,PV57215791118,1,3930.0,215791118,2021-03-15,CPD Tuition Reimbursement
57.0,2021-03-22,"MANGUERRA, GLENN L",10512046.0,PV57215791119,1,7260.0,215791119,2021-03-15,CPD Tuition Reimbursement
57.0,2021-03-22,"MANTLO, JOSEPH",10560833.0,PV57215791120,1,3960.0,215791120,2021-03-15,CPD Tuition Reimbursement
57.0,2021-03-22,"MARIN, JULIAN",10532460.0,PV57215791121,1,3750.0,215791121,2021-03-15,CPD Tuition Reimbursement
57.0,2021-03-22,"MARQUINA, CARLOS",10560832.0,PV57215791122,1,1920.0,215791122,2021-03-15,CPD Tuition Reimbursement
57.0,2021-03-22,"MARSHALL, NAJEE L",10560831.0,PV57215791123,1,3840.0,215791123,2021-03-15,CPD Tuition Reimbursement
57.0,2021-03-22,"MARTINEZ, JOHNATHON",10560829.0,PV57215791125,1,3840.0,215791125,2021-03-15,CPD Tuition Reimbursement
57.0,2021-03-22,"MARTINEZ, MAURICIO",10547325.0,PV57215791126,1,5130.0,215791126,2021-03-15,CPD Tuition Reimbursement
57.0,2021-03-22,"MARTINEZ, RODOLFO",10236688.0,PV57215791124,1,2880.0,215791124,2021-03-15,CPD Tuition Reimbursement
57.0,2021-03-22,"MARTINO, NIKOLO J",10551431.0,PV57215791127,1,3780.0,215791127,2021-03-15,CPD Tuition Reimbursement
57.0,2021-03-22,"MASOUD, HUSAM B",10558073.0,PV57215791128,1,3960.0,215791128,2021-03-15,CPD Tuition Reimbursement
57.0,2021-03-22,"MATOS, STEPHANIE",10551422.0,PV57215791129,1,2535.0,215791129,2021-03-15,CPD Tuition Reimbursement
57.0,2021-03-22,"MENDOZA, MARCO A",10512246.0,PV57215791131,1,3750.0,215791131,2021-03-15,CPD Tuition Reimbursement
57.0,2021-03-22,"MERCADO, ALEXANDER",10175611.0,PV57215791132,1,3333.75,215791132,2021-03-15,CPD Tuition Reimbursement
57.0,2021-03-22,"MIKHAIL, ZAYA E",10532462.0,PV57215791133,1,3750.0,215791133,2021-03-15,CPD Tuition Reimbursement
57.0,2021-03-22,"MINNIEFIELD, MORGAN A",10560828.0,PV57215791134,1,5130.0,215791134,2021-03-15,CPD Tuition Reimbursement
57.0,2021-03-22,"MIRABELLI, HALEY",10558040.0,PV57215791135,1,3870.0,215791135,2021-03-15,CPD Tuition Reimbursement
57.0,2021-03-22,"MITCHELL, ARTHUR D",10560836.0,PV57215791136,1,3870.0,215791136,2021-03-15,CPD Tuition Reimbursement
57.0,2021-03-22,"MITROGIANNIS, IOANNIS J",10558069.0,PV57215791137,1,3840.0,215791137,2021-03-15,CPD Tuition Reimbursement
57.0,2021-03-22,"MOSQUERA, SANDRA L",10551430.0,PV57215791139,1,3870.0,215791139,2021-03-15,CPD Tuition Reimbursement
57.0,2021-03-22,"MUHAMAD, IMRAN Y",10560835.0,PV57215791140,1,3960.0,215791140,2021-03-15,CPD Tuition Reimbursement
57.0,2021-03-22,"MUNOZ, MARITZA",10560827.0,PV57215791142,1,3870.0,215791142,2021-03-15,CPD Tuition Reimbursement
57.0,2021-03-22,"MURILLO, ELIZABETH",10551423.0,PV57215791143,1,3840.0,215791143,2021-03-15,CPD Tuition Reimbursement
57.0,2021-03-22,"MYKHNYCH, ILONA",10553513.0,PV57215791144,1,3840.0,215791144,2021-03-15,CPD Tuition Reimbursement
57.0,2021-03-22,"NEELY, SHANEY",10555613.0,PV57215791145,1,1920.0,215791145,2021-03-15,CPD Tuition Reimbursement
57.0,2021-03-22,"NEWELL, TYRONE D",10193624.0,PV57215791146,1,3780.0,215791146,2021-03-15,CPD Tuition Reimbursement
57.0,2021-03-22,"NIETO, GUILEBALDO",10544299.0,PV57215791147,1,3840.0,215791147,2021-03-15,CPD Tuition Reimbursement
57.0,2021-03-22,"NIEVES II, MIGUEL",10551420.0,PV57215791148,1,3386.25,215791148,2021-03-15,CPD Tuition Reimbursement
57.0,2021-03-22,"OLBRICH, MICHAEL F",52145034.0,PV57215791149,1,3870.0,215791149,2021-03-15,CPD Tuition Reimbursement
57.0,2021-03-22,"ORTEGA, NICOLE",10544303.0,PV57215791150,1,1046.25,215791150,2021-03-15,CPD Tuition Reimbursement
57.0,2021-03-22,"ORTIZ, PEDRO",10512233.0,PV57215791151,1,3840.0,215791151,2021-03-15,CPD Tuition Reimbursement
57.0,2021-03-22,"OWENS, DONNELL",10560825.0,PV57215791153,1,3960.0,215791153,2021-03-15,CPD Tuition Reimbursement
57.0,2021-03-22,"OWENS, RAYMOND",10236696.0,PV57215791152,1,3360.0,215791152,2021-03-15,CPD Tuition Reimbursement
57.0,2021-03-22,"PACHECO JR, ENRIQUE",10562489.0,PV57215700045,1,60.0,EPACHECO_23NOV2020_60,2020-11-23,CELLULAR ACCOUNT DATA FOR T-MOBLE ACCOUNT
57.0,2021-03-22,"PADILLA, ELISE M",10532465.0,PV57215791154,1,3750.0,215791154,2021-03-15,CPD Tuition Reimbursement
57.0,2021-03-22,"PARSEGIAN, SHERESE O",10560824.0,PV57215791155,1,5130.0,215791155,2021-03-15,CPD Tuition Reimbursement
57.0,2021-03-22,"PERDOMO, JAIRO",10237093.0,PV57215791156,1,1920.0,215791156,2021-03-15,CPD Tuition Reimbursement
57.0,2021-03-22,"PEREZ, BRANDON N",10551412.0,PV57215791158,1,3870.0,215791158,2021-03-15,CPD Tuition Reimbursement
57.0,2021-03-22,"PEREZ, SIMPLISIO",10237094.0,PV57215791157,1,4500.13,215791157,2021-03-15,CPD Tuition Reimbursement
57.0,2021-03-22,"PERSAUD, KEVIN",10560823.0,PV57215791160,1,3840.0,215791160,2021-03-15,CPD Tuition Reimbursement
57.0,2021-03-22,"PETERSON, QUANTILDA J",10558036.0,PV57215791161,1,3870.0,215791161,2021-03-15,CPD Tuition Reimbursement
57.0,2021-03-22,"PETTIT-ANDERSON, ERICA L",10560821.0,PV57215791162,1,3840.0,215791162,2021-03-15,CPD Tuition Reimbursement
57.0,2021-03-22,"PFEIFFER, MICHAEL",10513020.0,PV57215791163,1,5130.0,215791163,2021-03-15,CPD Tuition Reimbursement
57.0,2021-03-22,"PHILLIPS, ANTONIO",10551414.0,PV57215791164,1,3386.25,215791164,2021-03-15,CPD Tuition Reimbursement
57.0,2021-03-22,"PIECYK, ANDREW",10544326.0,PV57215791165,1,3360.0,215791165,2021-03-15,CPD Tuition Reimbursement
57.0,2021-03-22,"PRUGER, ROCCO R",55425024.0,PV57215791166,1,3780.0,215791166,2021-03-15,CPD Tuition Reimbursement
57.0,2021-03-22,"QUARTERMAN, CRAIG S",10512565.0,PV57215791168,1,2160.0,215791168,2021-03-15,CPD Tuition Reimbursement
57.0,2021-03-22,"RAKOCHYY, YAROSLAV",10558034.0,PV57215791169,1,3960.0,215791169,2021-03-15,CPD Tuition Reimbursement
57.0,2021-03-22,"RAMIREZ, GRACIE",55027030.0,PV57215791170,1,1440.0,215791170,2021-03-15,CPD Tuition Reimbursement
57.0,2021-03-22,"RASCHKE, WAYNE H",10135513.0,PV57215791171,1,3870.0,215791171,2021-03-15,CPD Tuition Reimbursement
57.0,2021-03-22,"REED, SCOTT",10551409.0,PV57215791172,1,6480.0,215791172,2021-03-15,CPD Tuition Reimbursement
57.0,2021-03-22,"REITZ, STEVEN",10179933.0,PV57215791173,1,6480.0,215791173,2021-03-15,CPD Tuition Reimbursement
57.0,2021-03-22,"RENO, DANIEL",10551411.0,PV57215791174,1,3870.0,215791174,2021-03-15,CPD Tuition Reimbursement
57.0,2021-03-22,"REYES, GUILLERMO",52146034.0,PV57215791175,1,3840.0,215791175,2021-03-15,CPD Tuition Reimbursement
57.0,2021-03-22,"REYES IV, CARMELO",10560815.0,PV57215791176,1,3840.0,215791176,2021-03-15,CPD Tuition Reimbursement
57.0,2021-03-22,"RIDER, LEMONICA M",10238010.0,PV57215791177,1,1920.0,215791177,2021-03-15,CPD Tuition Reimbursement
57.0,2021-03-22,"RIFE, EDGELY A",10560816.0,PV57215791178,1,4275.0,215791178,2021-03-15,CPD Tuition Reimbursement
57.0,2021-03-22,"ROBERTS, BRENDAN D",10555621.0,PV57215791179,1,3840.0,215791179,2021-03-15,CPD Tuition Reimbursement
57.0,2021-03-22,"RODRIGUEZ, ANDREA",10558030.0,PV57215791181,1,3840.0,215791181,2021-03-15,CPD Tuition Reimbursement
57.0,2021-03-22,"RODRIGUEZ BOYER, CARLA M",10228768.0,PV57215791184,1,438.0,215791184,2021-03-15,CPD Tuition Reimbursement
57.0,2021-03-22,"RODRIGUEZ, JESSICA",10551484.0,PV57215791183,1,3870.0,215791183,2021-03-15,CPD Tuition Reimbursement
57.0,2021-03-22,"RODRIGUEZ, MARIAN A",10220692.0,PV57215791180,1,7260.0,215791180,2021-03-15,CPD Tuition Reimbursement
57.0,2021-03-22,"RODRIGUEZ, RICHARD M",10132461.0,PV57215791182,1,3780.0,215791182,2021-03-15,CPD Tuition Reimbursement
57.0,2021-03-22,"ROMERO, LEILANI",10551486.0,PV57215791185,1,3870.0,215791185,2021-03-15,CPD Tuition Reimbursement
57.0,2021-03-22,"ROUMBOS, VASELIO D",10228770.0,PV57215791186,1,945.0,215791186,2021-03-15,CPD Tuition Reimbursement
57.0,2021-03-22,"SALGADO, MARIA",10232475.0,PV57215791188,1,3870.0,215791188,2021-03-15,CPD Tuition Reimbursement
57.0,2021-03-22,"SALINAS, STEVEN",10555628.0,PV57215791189,1,3840.0,215791189,2021-03-15,CPD Tuition Reimbursement
57.0,2021-03-22,"SANTANA, WILMA",10555622.0,PV57215791190,1,5130.0,215791190,2021-03-15,CPD Tuition Reimbursement
57.0,2021-03-22,"SAUCEDO JR., RUBEN",10555629.0,PV57215791191,1,3840.0,215791191,2021-03-15,CPD Tuition Reimbursement
57.0,2021-03-22,"SCHMITT, MARK",50119037.0,PV57215791192,1,3460.0,215791192,2021-03-15,CPD Tuition Reimbursement
57.0,2021-03-22,"SHEETZ, KEVIN M",50076217.0,PV57215791193,1,4650.0,215791193,2021-03-15,CPD Tuition Reimbursement
57.0,2021-03-22,"SHELTON, DARNELL X",10560814.0,PV57215791194,1,3840.0,215791194,2021-03-15,CPD Tuition Reimbursement
57.0,2021-03-22,"SHELTON EL, NEIL T",55027022.0,PV57215791195,1,3930.0,215791195,2021-03-15,CPD Tuition Reimbursement
57.0,2021-03-22,"SMITH, JARROD L",52347026.0,PV57215700034,1,150.0,JSMITH_11FEB2021_150,2021-02-11,CELLULAR ACCOUNT DATA FOR T-MOBILE PHONE
57.0,2021-03-22,"SMITH, JARROD L",52347026.0,PV57215700034,1,150.0,JSMITH_17FED2021_150.00,2021-02-17,CELLULAR ACCOUNT DATA FOR T-MOBILE PHONE
57.0,2021-03-22,"SMITH, JARROD L",52347026.0,PV57215700034,1,150.0,JSMITH_23FEB2021_150,2021-02-23,CELLULAR ACCOUNT DATA FOR THE T-MOBILE PHONE
57.0,2021-03-22,"SMITH, JARROD L",52347026.0,PV57215700034,1,150.0,JSMITH_24FEB2021_150,2021-02-24,CELLULAR ACCOUNT DATA FOR T-MOBILE PHONE
57.0,2021-03-22,"SMITH, JARROD L",52347026.0,PV57215700034,1,150.0,JSMITH_5FEB2021_150,2021-02-05,CELLULAR ACCOUNRT DATA FOR T-MOBILE PHONE
57.0,2021-03-22,"SMITH, MICHAEL J",10175644.0,PV57215791196,1,2210.0,215791196,2021-03-15,CPD Tuition Reimbursement
57.0,2021-03-22,"SOLECKI, RICHARD K",10553523.0,PV57215791197,1,3780.0,215791197,2021-03-15,CPD Tuition Reimbursement
57.0,2021-03-22,"SOLIS, TRYSHA",10558032.0,PV57215791198,1,5130.0,215791198,2021-03-15,CPD Tuition Reimbursement
57.0,2021-03-22,"STAKEN, MICHAEL",10532471.0,PV57215791200,1,4320.0,215791200,2021-03-15,CPD Tuition Reimbursement
57.0,2021-03-22,"STEVENS, MATTHEW O",10551482.0,PV57215791201,1,3780.0,215791201,2021-03-15,CPD Tuition Reimbursement
57.0,2021-03-22,"STROCCHIO, REBECCA L",10560810.0,PV57215791202,1,5130.0,215791202,2021-03-15,CPD Tuition Reimbursement
57.0,2021-03-22,"SULLIVAN, RICHARD J",10143736.0,PV57215791203,1,3870.0,215791203,2021-03-15,CPD Tuition Reimbursement
57.0,2021-03-22,"SUN, YANG",10560072.0,PV57215791204,1,5130.0,215791204,2021-03-15,CPD Tuition Reimbursement
57.0,2021-03-22,"SWIERCZYNSKI, PAWEL K",10551480.0,PV57215791205,1,1914.0,215791205,2021-03-15,CPD Tuition Reimbursement
57.0,2021-03-22,SYED H QUADRI,52346026.0,PV57215791167,1,9680.0,215791167,2021-03-15,CPD Tuition Reimbursement
57.0,2021-03-22,"TATE JR, JOHNNY E",50076211.0,PV57215791206,1,6840.0,215791206,2021-03-15,CPD Tuition Reimbursement
57.0,2021-03-22,"TENEYUQUE, GERARDO",50081261.0,PV57215791207,1,1980.0,215791207,2021-03-15,CPD Tuition Reimbursement
57.0,2021-03-22,THOMAS D DAVEY JR,51550030.0,PV57215791070,1,4869.0,215791070,2021-03-15,CPD Tuition Reimbursement
57.0,2021-03-22,THOMAS W BRESNAHAN,52560021.0,PV57215791063,1,5130.0,215791063,2021-03-15,CPD Tuition Reimbursement
57.0,2021-03-22,TORDAK S PERKINS,51282032.0,PV57215791159,1,1920.0,215791159,2021-03-15,CPD Tuition Reimbursement
57.0,2021-03-22,"TORRES JR, ERNESTO",10560801.0,PV57215791209,1,5130.0,215791209,2021-03-15,CPD Tuition Reimbursement
57.0,2021-03-22,"TORRES, SHANNON J",10551478.0,PV57215791208,1,5130.0,215791208,2021-03-15,CPD Tuition Reimbursement
57.0,2021-03-22,"TOTH, LOU",10551479.0,PV57215791210,1,3840.0,215791210,2021-03-15,CPD Tuition Reimbursement
57.0,2021-03-22,TRACIE L LIBERTY,50074813.0,PV57215791110,1,3870.0,215791110,2021-03-15,CPD Tuition Reimbursement
57.0,2021-03-22,UNITA L DAVIS,50645036.0,PV57215791071,1,5130.0,215791071,2021-03-15,CPD Tuition Reimbursement
57.0,2021-03-22,"VACCARO, JOSEPH P",10560800.0,PV57215791211,1,3840.0,215791211,2021-03-15,CPD Tuition Reimbursement
57.0,2021-03-22,"VARCHETTO, ANTHONY",10512194.0,PV57215791212,1,3750.0,215791212,2021-03-15,CPD Tuition Reimbursement
57.0,2021-03-22,"VARGA, NANE",10544333.0,PV57215791213,1,2620.0,215791213,2021-03-15,CPD Tuition Reimbursement
57.0,2021-03-22,"VARGAS, RUBEN",10154674.0,PV57215791214,1,3870.0,215791214,2021-03-15,CPD Tuition Reimbursement
57.0,2021-03-22,"VAZQUEZ, DAVE",10190914.0,PV57215791215,1,2565.0,215791215,2021-03-15,CPD Tuition Reimbursement
57.0,2021-03-22,"VILARETE, MARIA A",10547318.0,PV57215791216,1,2565.0,215791216,2021-03-15,CPD Tuition Reimbursement
57.0,2021-03-22,"VILLALPANDO, ERIK",10551469.0,PV57215791217,1,2880.0,215791217,2021-03-15,CPD Tuition Reimbursement
57.0,2021-03-22,"WALKER, BRITTON R",10553530.0,PV57215791218,1,3870.0,215791218,2021-03-15,CPD Tuition Reimbursement
57.0,2021-03-22,"WESSELHOFF, MELISSA K",10134817.0,PV57215791187,1,4495.5,215791187,2021-03-15,CPD Tuition Reimbursement
57.0,2021-03-22,"WHITE, HAROLD",10551475.0,PV57215791220,1,3360.0,215791220,2021-03-15,CPD Tuition Reimbursement
57.0,2021-03-22,"WHITFIELD, BETTY L",10560820.0,PV57215791221,1,5130.0,215791221,2021-03-15,CPD Tuition Reimbursement
57.0,2021-03-22,WILLIAM A JOHNSON,50074785.0,PV57215791098,1,3870.0,215791098,2021-03-15,CPD Tuition Reimbursement
57.0,2021-03-22,"WILLIAMS, GARY L",50075066.0,PV57215791222,1,2620.0,215791222,2021-03-15,CPD Tuition Reimbursement
57.0,2021-03-22,"WILLIAMS, PIERRE",10555611.0,PV57215791223,1,3840.0,215791223,2021-03-15,CPD Tuition Reimbursement
57.0,2021-03-22,"WOODS, MEGAN RAYE",10558031.0,PV57215791224,1,3960.0,215791224,2021-03-15,CPD Tuition Reimbursement
57.0,2021-03-22,"WORRELL, RENATA L",50585031.0,PV57215791225,1,3420.0,215791225,2021-03-15,CPD Tuition Reimbursement
57.0,2021-03-22,"ZAMBRANO, EMMANUEL",10555619.0,PV57215791226,1,8627.0,215791226,2021-03-15,CPD Tuition Reimbursement
57.0,2021-03-22,"ZIEBA, AGNIESZKA",10551477.0,PV57215791227,1,1620.0,215791227,2021-03-15,CPD Tuition Reimbursement
57.0,2021-03-30,"JENKINS, JAMAUL P",10547327.0,PV57205790091,1,1400.0,205790091,2020-04-30,CPD Tuition Reimbursement
59.0,2021-01-19,"ADREANI, JOHN J",10560670.0,PV59205901863,1,399.0,JADREANIFALL2020,2020-10-21,FIR 196 FALL 2020 TUITION REIMBURSEMENT
59.0,2021-01-19,"COREY III, ROBERT LEONARD",10177988.0,PV59205901868,1,399.0,RCOREYFALL2020,2020-10-14,FIR 195 FALL 2020 TUITION REIMBURSEMENT
59.0,2021-01-19,"CREMINS, KEVIN M",10560678.0,PV59205901866,1,399.0,KCREMINSFALL2020,2020-09-15,FIR 196 FALL 2020 TUITION REIMBURSEMENT
59.0,2021-01-19,"HOLMES, CHERI A",10560674.0,PV59205901861,1,798.0,CHOLMESFALL2020,2020-09-08,FIR 195 & 196 FALL 2020 TUITION REIMBURSEMENT
59.0,2021-01-19,"JEZIORNY, KEVIN M",10560679.0,PV59205901869,1,798.0,KJEZIORNYFALL2020,2020-12-08,FIR 195 & 196 FALL 2020 TUITION REIMBURSEMENT
59.0,2021-01-19,"LATA, BRIAN",10162469.0,PV59205901853,1,399.0,BLATAFALL2020,2020-09-17,FIR195-001 ALL 2020 TUITION REIMBURSEMENT
59.0,2021-01-19,"MAGGIO, ANTHONY PAUL",10560677.0,PV59205901867,1,768.0,AMAGGIOSPRING2020,2020-04-22,FIR 195 & 196 SPRING 2020 TUITION REIMBURSEMENT
59.0,2021-01-19,"MAIBUECHER, ROBERT J",10171825.0,PV59205901854,1,399.0,RMAIBUECHERFALL2020,2020-10-20,FIR 196 FALL 2020 TUITION REIMBURSEMENT
59.0,2021-01-19,"MC ALEER, SEAN A",10530529.0,PV59205901870,1,798.0,SMCALEERFALL2020,2020-09-18,FIR 195 & 196 FALL 2020 TUITION REIMBURSEMENT
59.0,2021-01-19,"NELSON, KARNA JO",10560672.0,PV59205901859,1,850.5,KNELSONSUMMER2020,2020-06-26,MOS 5101 SUMMER 2020 TUITION REIMBURSEMENT
59.0,2021-01-19,"OPIOLA, ROBERT G",10177978.0,PV59205901856,1,399.0,ROPIOLAFALL2020,2020-09-22,FIR 196 FALL 2020 TUITION REIMBURSEMENT
59.0,2021-01-19,"OQUENDO, MICHAEL R",10186825.0,PV59205901855,1,399.0,MOQUENDOFALL2020,2020-10-27,FIR 196 FALL 2020 TUITION REIMBURSEMENT
59.0,2021-01-19,"PEREZ, GUILLERMO",10179861.0,PV59205901858,1,798.0,GPEREZFALL2020,2020-09-15,FIR 195 & 196 FALL 2020 TUITION REIMBURSEMENT
59.0,2021-01-19,"ROCHE, ANTHONY M",10560671.0,PV59205901864,1,798.0,AROCHEFALL2020,2020-09-18,FIR 195 & 196 FALL 2020 TUITION REIMBURSEMENT
59.0,2021-01-19,"RODRIGUEZ, ROSALINDA",10560676.0,PV59205901865,1,337.5,RRODRIGUEZFALL2020,2020-08-18,FIR 235 FALL 2020 TUITION REIMBURSEMENT
59.0,2021-01-19,"RYAN, TIMOTHY M",10560675.0,PV59205901862,1,258.75,TRYANFALL2020,2020-09-15,FIR 1-08111 FALL 2020 TUITION REIMBURSEMENT
59.0,2021-01-19,"SAMPEY, ROBERT E",10560673.0,PV59205901860,1,825.0,RSAMPEYWINTER2020,2020-11-06,200106CF WINTER 2020 TUITION REIMBURSEMENT
59.0,2021-01-19,"STENSON, KEVIN M",10180645.0,PV59205901857,1,399.0,KSTENSONFALL2020,2020-10-01,FIR 195 FALL 2020 TUITION REIMBURSEMENT
59.0,2021-01-22,"FASAN, MATTHEW D",10560929.0,PV59205901879,1,798.0,MFASANFALL2020,2020-10-14,FIR 195 & 196 FALL 2020 TUITION REIMBURSEMENT
59.0,2021-01-22,"LUDWIG, ROBERT J",10560928.0,PV59205901875,1,399.0,RLUDWIGFALL2020,2020-09-10,FIR 196 FALL 2020 TUITION REIMBURSEMENT
59.0,2021-01-22,"O DONNELL, MATTHEW J",10560913.0,PV59205901878,1,798.0,MODONNELLFALL2020,2020-10-02,FIR 195 & 196 FALL 2020 TUITION REIMBURSEMENT
59.0,2021-01-22,"SCHINLER, JAMES N",10560911.0,PV59205901877,1,798.0,JSCHINLERFALL2020,2020-09-15,FIR 195 & 196 FALL 2020 TUITION REIMBURSEMENT
59.0,2021-01-22,"SINISI, JOSEPH V",10560927.0,PV59205901876,1,798.0,JSINISIFALL2020,2020-09-22,FIR 195 & 196 FALL 2020 TUITION REIMBURSEMENT
59.0,2021-01-22,"WINIECKI, THERESA",10560930.0,PV59205901874,1,798.0,TWINIECKIFALL2020,2020-09-14,FIR 195 & 196 FALL 2020 TUITION REIMBURSEMENT
59.0,2021-03-05,"ALLEN, MICHAEL J",10175431.0,PV59215900030,1,3137.0,MALLENFALL2020,2021-02-01,Fall 2020 TUITION REIMBURSEMENT
59.0,2021-03-05,"BARRERA, JOHN",10192547.0,PV59215900018,1,2850.75,JBARRERAFALL2020,2021-01-28,Fall 2020 TUITION REIMBURSEMENT
59.0,2021-03-05,"BASIC, KATRINA L",10227708.0,PV59215900036,1,1932.0,KBASICFALL2020,2021-02-01,Fall 2020 TUITION REIMBURSEMENT
59.0,2021-03-05,"COVARRUBIAS, JUAN F",10163049.0,PV59215900031,1,9680.0,JCOVARRUBIASFALL2020,2021-01-25,Fall 2020 TUITION REIMBURSEMENT
